,title,text
0,En prisión preventiva quedó adulto mayor acusado de abuso a una menor en Calbuco," Un hombre de 80 años fue formalizado por el abuso sexualEn prisión preventiva tras ser formalizado por abuso sexual de una niña de 13 años, porte ilegal de arma de fuego, municiones y receptación, terminó un hombre de 80 años en Calbuco, región de Los Lagos. Fue la madre de la víctima, quien realizó la denuncia detallando que cuando trabajaba para el imputado, acudía a su domicilio con su hija, la que denunció haber sufrido los abusos durante el verano. El fiscal de Calbuco, Julio Martínez, confirmó que cuando se detuvo al hombre se descubrió armamento que estaba con encargo por robo, una escopeta y cartuchos, por lo que fue arrestado tanto por la denuncia por abuso sexual, como por la tenencia de armas.  De acuerdo a los antecedentes el arma mantenía encargo desde 2005 y originalmente, el Tribunal de Garantía de Calbuco, no otorgó la cautelar de prisión preventiva, sin embargo, la Fiscalía apeló para que la Corte de Apelaciones resuelva el entrampado, instancia en la que se determinó su ingreso a la cárcel de Puerto Montt."
1,Dejan en prisión a adulto mayor imputado de abusos sexuales contra hija de su trabajadora,"En prisión preventiva permanece desde el fin de semana un adulto mayor, de 80 años, imputado por los delitos de abuso sexual y porte de armas de fuego y municiones. El acusado fue detenido por Carabineros en Calbuco, producto de una investigación llevada adelante por el Ministerio Público. Una niña de 13 años, víctima del presunto abuso sexual, fue quien relató a la policía que el imputado mantenía en su poder armas de fuego. Los hechos se remontan al verano de este año, cuando la denunciante habría sido abusada sexualmente por el adulto mayor. La mamá de la niña realizaba labores como asesora del hogar en la casa del imputado, trabajo que ejecutaba acompañada de la niña. ""Recibimos el 26 agosto de este año una denuncia por abuso sexual sufrido por una menor de 13 años y que fue realizada por la psicóloga del colegio donde asiste la víctima. Citamos a la víctima para el 8 de septiembre, para que entregara declaración, contando los hechos no sólo relativo al abuso sexual, sino que además el imputado mantenía armamento en su hogar"", relata el fiscal Julio Martínez, de Calbuco. Martínez explica que la víctima, en el verano, fue abusada al interior de un dormitorio. ""La menor afectada ratifica lo que nos había señalado la psicóloga del colegio, quien es la que denuncia el delito. La víctima fue a trabajar con su mamá a la casa del imputado y los hechos ocurren en el segundo día de trabajo. La menor no recuerda bien si fue en enero o febrero, pero sí señala que fue en el verano"", manifiesta. De acuerdo al persecutor penal, la niña en la habitación del imputado vio armas. ""Nos aporta antecedentes que en el vehículo que la fue a buscar con su mamá, en la parte inferior del asiento del conductor, tenía una especie de revólver"", sostiene. La indagatoria fue llevada adelante por Carabineros de la Sección de Investigación Policial (SIP), ""quienes toman declaración a la mamá. Ella ratifica la presencia de armas de fuego en la casa y en el vehículo. El jueves 9 (de septiembre), en la tarde, ingresó carabineros con el GOPE (tras autorización del Juzgado de Garantía). Se verifica en el inmueble y en el dormitorio que había una escopeta doble cañón calibre 16, y en el espacio común, en el living comedor, una caja con munición con 15 cartuchos calibre 12"". El teniente Esteban Inostroza, jefe de la SIP de la Cuarta Comisaría de Calbuco, agrega que el arma incautada no estaba inscrita y que el imputado carece de autorización de caza. Otro factor importante es que la escopeta tiene encargo por hurto desde el 2005, en Arauco. ""Se estableció que el arma del vehículo era de fogueo. Se trató de un procedimiento que tras la denuncia permitió una actuación rápida, en el esclarecimiento de los delitos denunciados"", explicó. El imputado fue sometido a la audiencia de control de la detención y se formularon cargos por cuatro delitos. Abuso sexual, porte de arma de fuego, porte de municiones y receptación. El Tribunal de Garantía de Calbuco no dio a lugar a la prisión preventiva, sin embargo, el Ministerio Público apeló la decisión, revirtiendo la medida la Corte de Apelaciones de Puerto Montt, que cambió la determinación del Juzgado de Garantía. El adulto mayor quedó en prisión preventiva en el penal de Alto Bonito. ""La menor afectada ratifica lo que nos había señalado la psicóloga del colegio, quien es la que denuncia el delito"" Julio Martínez,, fiscal adjunto de Calbuco"
2,Adulto mayor fue formalizado por abuso sexual contra menor de 13 años,"Un adulto mayor fue formalizado y dejado bajo la medida cautelar de prisión preventiva tras ser acusado de abuso sexual contra una niña de 13 años, porte ilegal de arma de fuego, municiones y receptación en la comuna de Calbuco. De acuerdo a lo sostenido por Radio Bio-Bio, los hechos, los cuales fueron denunciados por la madre de la víctima, habrían ocurrido cuando ambas concurrían al domicilio del acusado por motivos laborales. Frente a ello, personal policial procedió a efectuar la detención del hombre de 80 años, quien poseía una escopeta y cartucho, cuyo armamento estaba con encargo por robo, siendo arrestado por los delitos mencionados. En consecuencia, tras su formalización, el Tribunal de Garantía de Calbuco determinó otorgar la prisión preventiva para el imputado, quien deberá cumplir la medida cautelar en la cárcel de Puerto Montt mientras dure la investigación del suceso. Foto: Pixabay."
3,Joven con 6 causas pendientes queda en prisión tras furtivo asalto en Ancud,"La gravedad de la pena asignada al delito y las múltiples causas delictivas pendientes que tiene el imputado fueron factores que incidieron para decretar la prisión preventiva en su contra, tras ser encausado en las ultimas horas por un furtivo asalto cometido en el sector Pudeto Bajo de la comuna de Ancud. A la altura del puente Viejo se produjo el ataque contra la víctima de 21 años, quien dio cuenta a Carabineros de la Primera Comisaría local, que un desconocido lo amenazó con un arma blanca con la intención de sustraerle especies. Sin posibilidad de defensa y con el temor de una eventual agresión, el ancuditano procedió a entregar su teléfono celular al delincuente, tras lo cual denunció el hecho. Con esos antecedentes se activó un procedimiento que permitió la aprehensión en flagrancia del sujeto. El encartado de iniciales L. H. C. A. (23) fue puesto a disposición del Juzgado de Garantía de la comuna del norte de la Isla, donde no se incidentó la legalidad del operativo policial. Asimismo, en la audiencia virtual el fiscal Javier Calisto formalizó al oriundo de Calbuco por el delito de robo con intimidación. La cautelar más gravosa invocó el persecutor, sustentando su petición en la evidencia recabada para acreditar la existencia del ilícito y la participación del imputado. ""Según lo expresado por la víctima, un sujeto le exhibió un cuchillo para apoderarse de su celular. Luego, esta misma persona habría destruido el teléfono para arrojarlo al río"", expuso el abogado, sumando que al llegar la patrulla de uniformados, el mismo afectado ""sindicó al imputado que estaba en el mismo lugar, en las proximidades del puente Viejo"". Para reforzar esta hipótesis, el jurista remarcó que Carabineros al arribar al sitio del suceso logró visualizar que el calbucano arrojó un elemento al afluente, que correspondería al arma blanca empleada en el asalto. Junto a esta información que reafirmó los presupuestos materiales del ilícito y su eventual ejecutor, el representante el Ministerio Público fundamentó la necesidad de cautela en la gravosidad del delito encausado, el cual tiene pena de crimen (parte de los 5 años y un día de presidio), como también en el prontuario del joven. ""La persona tiene antecedentes, procesos pendientes por delitos de otra naturaleza, lo que demuestra que no tiene irreprochable conducta anterior"", esgrimió el fiscal. Seis son las causas en que está notificado el agricultor: dos por daños simples, otro par por lesiones menos graves en contexto de violencia intrafamiliar, una por amenazas y la última por conducción en estado de ebriedad y negativa a la alcoholemia. Más allá de este escenario, el defensor Filippo Corvalán se opuso a esta medida, argumentando que ""con la información proporcionada no existe claridad sobre la existencia del delito"". Pese a los descargos, la magistrada Isabel Velásquez estableció que la libertad del imputado constituye un peligro para la seguridad de la víctima y la sociedad, decretando la prisión preventiva. Desde ya, el defensor Corvalán adelantó que apelará ante el tribunal de alzada para modificar esta precautoria que a su juicio es desproporcionada. Más allá de estos ataques delictivos, como ""puntuales y aislados"" han sido calificados estos asaltos. Y la estadística lo demuestra. Según el Sistema Táctico de Operación Policial (STOP), en la Primera Comisaría de Carabineros de Ancud, todos los casos policiales (denuncias y detenidos flagrantes) por robos exhiben una baja de un 41% este año, hasta el 24 de octubre, en comparación a igual periodo del 2020. Específicamente, apenas 3 casos por robos con intimidación se habían registrado esta temporada en ese lapso, y 4 fueron los robos con violencia, equivalentes a -50% y -33%, respectivamente con relación al año pasado. 60 días se decretaron para el desarrollo de las diligencias por esta causa por robo con intimidación. 7 casos por robos con intimidación y violencia registraba la Primera Comisaría este año hasta el 24 de octubre."
4,Imputado golpea a gendarme e intenta fugarse del hospital,"Inconsciente resultó un funcionario de Gendarmería, tras ser golpeado en la cabeza por un imputado mientras lo custodiaba en la unidad de urgencia del Hospital de Puerto Montt, a la espera de un cupo en el servicio de psiquiatría. El imputado fue remitido a psiquiatría desde el Juzgado de Garantía de Calbuco, por un presunto delito sexual. La falta de cupos en la unidad especializada habría sido el detonante de la espera en una sala de urgencia del recinto asistencial. El hecho ocurrió ayer, cerca de las 07.30 horas, mientras el gendarme vigilaba al imputado, quien a raíz de esto será sometido a peritajes para determinar si es imputable o no. La cabo Iris Álvarez, secretaria provincial de la Asociación de Funcionarios de Gendarmería (Ansog) de la provincia de Llanquihue, explicó que su colega estaba a cargo de un acusado que está con internación provisoria por el Juzgado de Garantía de Calbuco. ""Él lo agrede con un objeto contundente y queda inconsciente el funcionario. El imputado tras ello logra abrir una puerta con dirección a la vía pública. Personal de seguridad del recinto hospitalario se percata de la situación y en ese momento el gendarme se recupera y sale -como pudo- a darle alcance"", indica. De acuerdo a la dirigenta, los tribunales ordenan la internación provisoria en el centro de psiquiatría del Hospital de Puerto Montt y Gendarmería se tiene que hacer cargo de la custodia. ""Ellos están por la patología psiquiátrica que presentan y suceden agresiones y no de la magnitud de lo ocurrido hoy (ayer)"". Agrega la cabo que el imputado estaba en otra sala (en urgencia) ""porque no hay cupos en el servicio de psiquiatría, pero desde esta unidad se ha informado en reiteradas oportunidades que ellos están colapsados con las camas"". Desde la dirección regional de Gendarmería se confirmó que el gendarme recibió un golpe en la cabeza que le provocó un TEC e incluso inconsciencia por algunos segundos. La escena fue presenciada por un guardia de seguridad, quien ayudó a recuperarse al funcionario de Gendarmería. Juntos lograron capturar al individuo en las afueras de la zona de Urgencia del hospital y llevarlo de regreso al recinto. El director regional de Gendarmería, coronel Pedro Villarroel, explicó que ""la persona que protagonizó los hechos estaba en un box del primer piso, esperando para ser internado en el área de psiquiatría, cuando golpeó por sorpresa a nuestro funcionario en la cabeza"". Agrega que ""afortunadamente no logró escapar y fue ingresado tal como lo solicitó el tribunal de Calbuco. De esta situación se dio cuenta al Ministerio Público y, además, se ordenó la realización de un sumario administrativo para esclarecer la forma en que ocurrieron los hechos"". El funcionario de Gendarmería fue atendido en un centro asistencial de Puerto Montt, donde se le diagnosticó un traumatismo encéfalo craneano (TEC). El ministro Patricio Rondini, vocero de la Corte de Apelaciones de Puerto Montt, explica que el Código Procesal Penal ordena que cuando un juez de garantía priva de libertad a una persona con problemas psiquiátricos, que puede ser un peligro para sí o para terceros, ""esta internación provisional no puede ser cumplida en un establecimiento de Gendarmería, sino que debe ejecutarse en un establecimiento sanitario donde pueda recibir la atención médica necesaria"". Indica que ""en este sentido, se trata de un imperativo legal para el juez. A su vez, el interno queda sujeto al control de Gendarmería dentro del establecimiento sanitario. El legislador toma esta medida considerando que el imputado, al momento del delito, es o puede ser inimputable por enajenación mental y no puede dársele el mismo trato que a una persona sana"". 7.30 horas de ayer ocurrió la agresión en la unidad de urgencia del Hospital Puerto Montt. 1 lesionado arrojo el incidente ocurrido ayer en la mañana en el centro asistencial. 1 imputado es el responsable de esta agresión que provocó un TEC en el gendarme."
5,Hombre de 62 años es imputado por ataque y abuso sexual contra sus nietas: fue formalizado,"Tras tres meses de indagación por parte de personal de la Sección de Investigación Policial (SIP), Carabineros efectuó la detención de un hombre, quien es acusado de violación y abuso sexual contra sus dos nietas en Calbuco. Según informó Soy Puerto Montt, los hechos habrían ocurrido entre el 2010 y el 2017, siendo la madre de una de las víctimas informada por su sobrina, quien sospechaba que su prima podría estar siendo abusada por el sujeto. Producto a esto, la madre denunció el hecho ante el Ministerio Público, donde se detalló que el hombre es imputado por cinco violaciones y un abuso sexual contra ambas menores de edad. Ante ello, el imputado de 62 años fue detenido y formalizado, quedando bajo la medida cautelar de prisión preventiva. Se fijó un plazo de 80 días para el curso de la indagación. Foto: Carabineros."
