,title,text
5,Absuelven a acusado de femicidio y crimen de Caguach queda impune,"Calificando la investigación como ""deficiente"", incluso con actuaciones policiales vulneratorias, durante la tarde de ayer el Tribunal Oral en lo Penal (TOP) de Castro absolvió al sujeto acusado de asesinar a su ex pareja en la isla Caguach, comuna de Quinchao. Un caso por femicidio en que el isleño arriesgaba cadena perpetua calificada, pero que con esta decisión quedó impune. La sala presidida por el magistrado (s) Elías Agüero, después de ocho jornadas de audiencia, entregó su veredicto unánime en el que acreditó que la jornada del 19 de diciembre del 2019 Mónica Mansilla Muñoz (54) fue agredida al interior de su domicilio con golpes de puños y patadas, hasta ser estrangulada perdiendo la vida por asfixia. Además, en su exposición el juez presidente remarcó que este ""es un hecho de violencia extrema"", en el cual se analizaron los antecedentes con una perspectiva de género, incluyendo la normativa internacional como la Convención de Belem do Pará. Sin embargo, no se logró atribuir la autoría en este ataque al encartado. ""Los acusadores no incorporaron en el juicio los elementos de prueba para situar al acusado en el sitio del suceso, más que los dichos de un testigo, en un horario que no se condice con la data de muerte ni con la naturaleza y multiplicidad de lesiones que sufrió la víctima"", dijo el sentenciador. Es más, la fuente en su lectura recalcó que la evidencia presentada ""solo consistió en antecedentes indiciarios"" entregados por la policía, los cuales ""no resultaron idóneos ni eficaces"". Incluso, agregó que la labor investigativa presentó ""serias deficiencias y debilidades"", no permitiendo situar en el lugar al acusado y atribuirle participación. Bajo este escenario, los magistrados desecharon los cargos contra el isleño, alzando de manera inmediata la prisión preventiva que pesaba en su contra desde comienzos de marzo del 2020. La decisión se enmarcó en los postulados que presentó el defensor particular Andrés Firmani, quien cuestionó desde los albores de su representación, el despliegue realizado por la Brigada de Homicidios (BH) de Puerto Montt. Sostuvo el jurista en sus alegatos que los medios probatorios ""son contradictorios y generan más dudas que certezas"", ejemplificando que un perito describe que la data de muerte de la víctima sería las 4 de la madrugada, ""pero no existe prueba alguna que demuestre que el imputado estuvo a esa hora en el domicilio"". Asimismo, explicó el penalista que ""la contaminación del sitio del suceso es grosera y no puede arrojar prueba valorable"". No dudó en señalar que ""se hizo todo mal en este procedimiento policial"". Igualmente, el profesional esbozó la vulneración de garantías constitucionales de su cliente, lo cual igual fue estimado por los juzgadores, en especial en cuanto al levantamiento de evidencia. ""Estamos hablando de una causa por femicidio, en la cual el estándar de la prueba debe ser mayor, sin contradicciones ni omisiones. Pero acá hubo horrorosas infracciones: contra la intimidad de mi representado, como al debido proceso"", indicó Firmani, señalando que se incautaron ropas y el cinturón del isleño desde su pieza, ""sin existir un contexto de flagrancia e ingresando a su pieza sin su autorización"". Esta resolución marca un verdadero mazazo para los acusadores que invocaban la máxima sanción de nuestra legislación. De acuerdo a lo expuesto por el fiscal Luis Barría durante la audiencia, la prueba era suficiente para acreditar el tipo penal como la intervención del imputado, primordialmente por los datos entregados por un testigo presencial que habría visto ingresar al sujeto a la casa de su exconviviente. A ello, sumó los datos policiales, periciales y evidencia científica, como un comparativo de ADN de dos pelos levantados del cinturón del acusado, que correspondían a la mujer. Más allá de esta decisión, el persecutor precisó que se esperará la lectura de la sentencia programada para este martes, ""para analizar los eventuales recursos a interponer en atención a los fundamentos que tuvo el tribunal para absolver"". También espera analizar a fondo este fallo el abogado Patricio Olivares, quien representa como querellante a Iván Aro, hijo de la víctima. Eso sí, advirtió que recurrirá ante la Corte de Apelaciones de Puerto Montt. ""Resultan vergonzosas las eventuales bases que tuvo el tribunal para absolver a una persona que comete un delito atroz. Hay que esperar la sentencia para estudiar el contenido de la misma y recurrir de nulidad, a fin de revertir este resultado que en nada ayuda a la reparación de la familia ni mucho menos a la seguridad de la comunidad"", explicó el jurista. Añadió la fuente que ""en ese orden de ideas no comparto los argumentos normativos vertidos por el tribunal, ya que ni siquiera la defensa rinde prueba al respecto, lo que deja de manifiesto el actuar garantista del tribunal"". Thomas Patri, abogado del Servicio de la Mujer y Equidad de Género (SernamEG) de Los Lagos, en representación de Isabel Aro, como Tania Sánchez, querellante por Marcia Aro, igual esperan estudiar a fondo la sentencia para evaluar acciones legales posteriores."
6,Chiloé se moviliza tras fallo que absolvió a un imputado de femicidio,"La Isla Grande de Chiloé se está movilizando para pedir justicia por el femicidio de Mónica Mansilla, luego que el Tribunal Oral en Lo Penal de Castro resolviera el martes de esta semana absolver al único imputado de este crimen ocurrido el 19 de diciembre de 2019, en la isla Caguach, en la comuna de Quinchao. Marcia Haro, una de las hijas de la víctima, sostuvo que hay pruebas suficientes para acreditar la participación de la ex pareja de su madre. Asimismo, criticó la postura de los jueces que no fueron capaces, dijo, de tomar la decisión que correspondía. En tanto, Isabel, también hija de Mónica Mansilla, expresó su desazón por lo el fallo, aseverando que el ex conviviente siempre fue una persona agresiva y que actualmente ellas tienen temor porque este hombre está en libertad. Por su parte, el alcalde de Quinchao, René Garcés, manifestó que el veredicto absolutorio fue un golpe muy duro para toda la comunidad de Chiloé. Garcés adelantó que el municipio local se hará parte de la petición de nulidad de juicio junto al Ministerio Público Cabe mencionar que desde el martes 21 de septiembre las partes involucradas tienen 10 días para recurrir de nulidad a la Corte de Apelaciones de Puerto Montt. Asimismo, una de las razones de la absolución del imputado, según el Tribunal, es que algunas de las pruebas obtenidas por la fiscalía no respetaron las garantías debidas."
7,Hombre quedó en libertad tras ser acusado por femicidio: Justicia lo absolvió por falta de pruebas,"El Tribunal de Juicio Oral en lo Penal de Castro absolvió, este miércoles, a C.I.V.V., acusado como autor del delito de femicidio, al no lograr convicción de que haya participado en el delito en 2019, en la comuna de Quinchao.Los hechos ocurrieron el 19 de diciembre, cuando la víctima, identificada como M.C.M.M. en su domicilio ubicado en el sector La Capilla de la Isla Caguach, en la comuna de Quinchao, fue agredida reiteradamente con golpes de puño y patadas en el rostro, en el pecho, en los brazos y piernas, para finalmente ser estrangulada, perdiendo la vida. ""No es posible atribuir más allá de toda duda razonable a C.V.V. la autoría en los hechos acreditados y en la forma descrita en la acusación, desde que los acusadores no incorporaron al juicio otros elementos de prueba para situar al acusado en el sitio del suceso, más que los dichos del testigo C.A., en un horario y lapso de tiempo que no se condice ni con la data de muerte, ni con la naturaleza y multiplicidad de lesiones en el cuerpo de la víctima, de acuerdo a lo expuesto por el médico legista Sr. Rodrigo Águila Mansilla y la información aportada por el funcionario PDI Franco Cárdenas Ramírez, según se explicitará en detalle en la sentencia"", explicó el veredicto.Para el tribunal, la prueba aportada al juicio por los persecutores ""solo consistió en antecedentes indiciarios, entregados por testigos funcionarios policiales y peritos del Laboratorio de Criminalística de la PDI, que valorados en forma individual y en su conjunto, no resultaron idóneos, ni eficaces para corroborar la imputación en la forma planteada por los acusadores, atendida las serias deficiencias, debilidades y contradicciones observadas en la labor investigativa, que no logró ser dilucidada durante la audiencia de juicio, y que no permitió situar al acusado en el lugar de los hechos y atribuirle la autoría de las lesiones y de la muerte de su ex conviviente""En la audiencia, además, el tribunal ordenó el alzamiento de la medida cautelar de prisión preventiva a que se encontraba sujeto el acusado y ordenó su libertad inmediata."
8,Alegan por recurso que busca anular absolución contra acusado de crimen,"En una nueva instancia jurídica del bullado caso por el asesinato de Mónica Mansilla Muñoz (54), ocurrido en la isla Caguach, comuna de Quinchao, se realizaron los alegatos de los intervinientes por el recurso de nulidad interpuesto contra el juicio y la sentencia que absolvió al único acusado, quien arriesgaba cadena perpetua calificada. Ante la segunda sala de la Corte de Apelaciones de Puerto Montt se llevó a cabo esta instancia legal, la cual precede al veredicto y posterior sentencia emitida -15 y 21 de septiembre pasado, respectivamente- por el Tribunal Oral en lo Penal de Castro que liberó al sujeto de iniciales C. I. V. V. (45) de los cargos de femicidio. El isleño enfrentó juicio por el crimen de quien fue su pareja por 17 años, quien falleció estrangulada y con al menos 20 lesiones. Su cuerpo fue hallado en su domicilio, el 19 de diciembre del 2019. Los acusadores expusieron ante los ministros los fundamentos de sus recursos. Por el Ministerio Público, la abogada asesora Mónica Saavedra entregó sus argumentaciones; como también sucedió con Javier Cruz, en representación de Iván Aro, hijo de la víctima. Igual alegaron la jurista Tania Sánchez, querellante por Marcia Aro (hija de la fallecida), y el asesor legal del Servicio de la Mujer y Equidad de Génro (SernamEG) Los Lagos, Thomas Patri. Todos los acusadores coinciden como causal de nulidad que la prueba presentada ante los jueces de primera instancia no fue valorada en su totalidad. Incluso, que se realiza una valoración sesgada de la evidencia, que a su juicio fue coherente para sustentar los cargos y participación del imputado. Asimismo, Patricio Olivares, quien representa a Iván Aro, pero que no pudo comparecer a los alegatos, fundamentó en el requerimiento escrito que hubo una errónea aplicación del derecho, lo cual influyó en este fallo. Ahora, escuetamente remarcó que ""resta esperar que la Corte se pronuncie a nuestro favor"". La solicitud de todos los acusadores es la realización de nuevo juicio oral. Por su parte, Thomas Patri detalló que ante la cantidad de recursos ""se trató de una audiencia extensa"". Agregó que ""la estrategia planteada puede llegar a la anulación del juicio. Bueno, esperamos que así sea y podamos entregar algo de justicia a la familia, a doña Mónica y la comunidad de Caguach"". Finalmente, por el recurrido compareció en la sala el abogado Cristián Arias, quien entregó sus bases para desvirtuar los requerimientos y que se confirme la resolución. Será la fiscal judicial Mirta Zurita la encargada de redactar el fallo de alzada, el cual será comunicado el 15 de noviembre próximo. 19 de diciembre del 2019: Mónica Mansilla muere estrangulada en su casa."
9,Municipios coordinan acciones para pesquisar el abuso sexual infantil en medio de la pandemia del covid,"Desde el inicio de la pandemia, las distintas oficinas de Protección de Derechos de Infancia, OPD, de los municipios isleños han alertado sobre el posible riesgo del aumento de casos de maltrato y abuso sexual infantil a lo largo del territorio insular. Frente a lo anterior y para frenar este flagelo, desde hace unos meses se reactivaron las ""Mesas de infancia"", con la finalidad coordinar acciones preventivas, pesquisar agresiones y establecer protocolos de derivación cuando surjan casos de maltrato infantil. Dichas instancias también pretenden mejorar y fortalecer los canales de información entre todos los integrantes de la red local. Actualmente, las cuatro OPD que existen en la provincia y que dependen de los municipios de Ancud, Castro, Quellón y Quinchao, atienden a unos 250 menores de distintos puntos de Chiloé y los profesionales advierten que las denuncias en torno a las agresiones infantiles han disminuido en un 40% desde que el coronavirus se instaló en el territorio insular. Recalcan que urge reforzar las coordinaciones con las redes locales, fortalecer el protocolo de derivación y la responsabilidad de denunciar en caso de sospecha o vulneraciones, principalmente en aquellas causales de delito. ""Estas acciones buscan articular estrategias para enfrentar esta problemática y reforzar la obligación de denunciar para quienes sospechan o reciben algún relato por parte de un niño, niña y/o adolescente"", advierte Daniela Valencia, asistente social y coordinadora de la OPD del municipio de Ancud. denuncias En relación a las denuncias espontáneas desde la comunidad, la profesional remarca que ha habido una considerable baja, lo cual -a su juicio- es preocupante, quedando la interrogante de lo que ocurre. ""Sabemos que existe dificultad de pesquisar como resultado de la crisis sanitaria por el covid. Lo mismo sucede con las derivaciones realizadas por las redes, considerando que la mayoría de las derivaciones se recibían desde las áreas de la educación y salud, por lo cual se ha visto en desmedro la posibilidad de visibilizar vulneraciones hacia niños, niñas y /o adolescentes"", acota. Una mirada similar tiene Gabriela Solís, coordinadora de la OPD Zona Sur Castro, quien indica que si bien la cantidad de casos ingresados han disminuido por la pandemia, ""esto no quiere decir que las vulneraciones hacia los menores hayan desaparecido. Las escuelas y liceos no estuvieron funcionando por más de un año y medio y eso dificultó que se visibilizarán las denuncias y derivaciones. Por esto es fundamental que con el retorno de los estudiantes a las aulas se articular acciones que permitan visibilizar esta problemática para combatir los abusos infantiles"". Desde Quinchao, la coordinadora de la OPD comunal, Adriana Barrientos, sostuvo que tras la pandemia se implementó el uso de redes sociales para realizar la promoción de los derechos de infancia, reactivar la red intersectorial y promover reuniones virtuales para atender los casos que se derivan. ""Pese a todas las dificultades que se presentan por la pandemia, las intervenciones de mayor urgencia en cuanto a vulneraciones de derechos se atienden de manera presencial a través del equipo sicosocial y jurídico, para indagar las denuncias y atender a las víctimas. También se mejoró la conexión para trabajar los casos más aislados de la comuna, sobre todo con el Desam de Quinchao y el área de Educación"", aclara. Frente a la emergencia sanitaria que aún vive la provincia y que obligó a aislar por varios meses a los menores en sus hogares, las redes de apoyo online y el fono denuncia ayudan para hacer visible esta problemática y adquieren una relevancia mayor. Las profesionales concuerdan que, a lo anterior, se debe fortalecer el soporte del grupo familiar para detectar y evitar este tipo de actos. Mientras continúe la pandemia, la prevención, la protección y la denuncia oportuna seguirán siendo la mejor arma para combatir con fuerza el abuso sexual infantil que silenciosamente sigue asfixiando a cientos de niños y niñas de este apartado territorio insular. ""Estas acciones buscan articular estrategias para enfrentar esta problemática en la Isla y reforzar la obligación de denunciar"". Daniela Valencia,, coordinadora de la OPD, de Ancud."
10,Anulan fallo que absolvió a acusado de femicidio en Caguach: habrá otro juicio,"En lo que constituye un contundente golpe a lo dispuesto por el Tribunal Oral en lo Penal (TOP) de Castro, la segunda sala de la Corte de Apelaciones de Puerto Montt revocó ayer la resolución absolutoria que había beneficiado a un sujeto, acusado de un delito de femicidio perpetrado en la isla Caguach, Quinchao. También se anuló el juicio por el asesinato de Mónica Mansilla Muñoz (54), con lo cual se fijará una nueva audiencia para debatir la responsabilidad del encartado, quien arriesga presidio perpetuo calificado. La sala presidida por el magistrado (s) Elías Agüero liberó de los cargos al isleño de iniciales C. I. V. V. (45), en un fallo de primera instancia emitido el 21 de septiembre pasado, en el cual se calificó como ""deficiente"" la indagatoria e ""insuficiente"" la evidencia presentada para vincular al imputado al crimen. Sin embargo, esa misma prueba fue la que se consideró en alzada para derogar este dictamen. Según expusieron los ministros, se acogió la causal de nulidad presentada por los cuatro acusadores, enfocada en la falta de valoración de todos los medios probatorios en el fallo del TOP, como en la ausencia de una exposición clara, lógica y completa de cada uno de los hechos. Remarcaron que no se contempló en la sentencia la declaración de dos testigos sobre la prenda de vestir de la víctima hallada en el lugar de trabajo del acusado, como tampoco se valoró con perspectiva de género la prueba (solo se consignaron algunos hechos de violencia intrafamiliar anteriores, pero no se relacionaron a la agresión mortal). Además, por las dos diligencias de la Brigada de Homicidios (BH) en el domicilio del imputado, que habían sido declaradas ilegales, la Corte determinó que se cumplieron los requisitos legales para la autorización de la dueña al ingreso a la pieza del encartado, en unas pesquisas que contaron con instrucción fiscal. Es más, en el fallo de alzada se informó que la sentencia del TOP ""no analiza toda la prueba rendida, que no pondera individual y comparativamente, ni proporciona antecedentes suficientes que permitan reproducir el razonamiento de los juzgadores"". Se agregó que resulta ""relevante la omisión en que se ha incurrido de no consignar en el fallo ni siquiera una somera síntesis de las declaraciones de todos los testigos, en términos que permitan contrastarlas y comprender las razones por las cuales se da mayor valor a uno u otro testimonio"". De esta forma, se acogió el recurso de nulidad ante lo cual se realizará un nuevo juicio oral con un tribunal no inhabilitado. Esta resolución causó alivio y revivió la ilusión de encontrar justicia por parte de los cercanos a la víctima. Iván Aro, hijo de Mónica, no ocultó su alegría por este vuelco en el caso, señalando que ""valió la pena insistir en estas instancias, puesto que estamos convencidos que hay prueba contundente contra el acusado. Esto era lo lógico, lo que esperábamos como familia"". Desde ya, la fuente remarcó que están trabajando para que en la próxima audiencia se llegue a un veredicto condenatorio. ""Volvió la esperanza para no dejar impune el crimen de mi mamá. Por eso, trabajaremos con nuestro abogado para analizar todo y esperar que ahora la prueba no deje dudas"", acotó. Patricio Olivares, quien tiene el patrocinio legal del joven como querellante, destacó este dictamen de alzada, enfatizando que ""se acogió lo presentado en el recurso de nulidad, con relación a los errores manifiestos en que incurrió el TOP de Castro al momento de la valoración de la prueba, entre otros motivos"". Sumó el jurista que otros jueces deberán conocer los antecedentes de la causa, ""apuntando a lo que siempre hemos perseguido, conseguir la condena que hemos pedido para la persona culpable del femicidio y se haga justicia"". En tanto, Thomas Patri, abogado del Servicio Nacional de la Mujer y Equidad de Género (SernamEG) de Los Lagos, quien también interviene como querellante, precisó que ""estamos contentos con lo resuelto por la segunda sala de la Corte de Apelaciones de Puerto Montt y ahora esperamos tener una nueva fecha y un nuevo tribunal no inhabilitado para celebrar nuevamente el juicio, y esta vez lograr la condena que pueda dar justicia a la familia de doña Mónica"". Carmen Barra, vocera de la Fiscalía Regional de Los Lagos, señaló que se valora la decisión de alzada, ""recaída en el recurso de nulidad que interpusimos"", fundamentado ""en la valoración incompleta que a nuestro juicio hizo el TOP de Castro respecto a los medios de prueba presentados, como asimismo en la falta de perspectiva de género en la apreciación de dichos medios. Sin embargo, la Corte de Apelaciones acogió los planteamientos de la Fiscalía y los querellantes"". A su vez, la abogada reafirmó el compromiso del ente persecutor con la familia de la víctima, ""como también de todas las mujeres que sufren violencia de género. No se escatimarán esfuerzos para buscar que los responsables de estos graves hechos reciban la sanción que corresponde"". 19 de diciembre del 2019 se produjo el asesinato de la conocida vecina de la isla Caguach. 20 lesiones, a lo menos, sufrió la mujer en su domicilio. Murió estrangulada"
11,Adulto mayor admite furtivo ultraje a niña en sector Cohen,"Un rápido término tuvo una causa por un delito sexual infantil en Quinchao, luego que el imputado admitiera su responsabilidad en el ataque a una menor de 13 años. A la entrada de su hogar en Cohen sufrió la embestida la víctima, quien incluso debió recibir la ayuda de su hermanito para zafar de su agresor. En el Juzgado Mixto de Achao se expusieron los antecedentes de este caso, que quedaron en evidencia tras la rápida y valiente denuncia de la estudiante, quien dio cuenta que un vecino le realizó tocaciones impropias. La develación a la madre fue la antesala de la notificación a Carabineros, que se constituyó en el lugar y procedió a la aprehensión del encartado. 65 años tiene el sujeto sindicado como responsable del furtivo ataque, cuya detención fue declarada ajustada a derecho. Además, fue formalizado en la misma audiencia por abuso sexual infantil en grado de consumado. Ante la posibilidad de arriesgar una mayor pena o incluso, quedar en prisión preventiva durante la indagatoria, el isleño decidió reconocer los hechos de la acusación verbal que presentó en la ocasión, el fiscal (s) Cristian Mena, en base a la evidencia reunida. Especial valor cobró el testimonio de la menor y testigos. Por esta ""confesión"", el adulto mayor accedió a un procedimiento abreviado. ""Fue condenado a 541 días de presidio menor en su grado medio y se le sustituyó esa pena por la libertad vigilada intensiva, quedando también con las condiciones especiales de prohibición de acercarse a la niña, como a su domicilio, y de toda comunicación hacia ella y su grupo familiar"", explicó el persecutor. El dictamen del magistrado Bruno Casale fue valorado por el defensor Nelson Troncoso, primordialmente porque ""existía una opción latente en que se pidiera y decretara la cautelar más gravosa"". Su representado no tiene irreprochable conducta anterior, presentando dos condenas del 2015 por desacato. Asimismo, el abogado resaltó que ""se logró concluir una causa que podría haberse extendido por un año, con medidas privativas de por medio, y que cerró con una pena sustitutiva"". Para llegar a este resultado, el profesional expuso datos ante el sentenciador, como el arraigo social, familiar y laboral de quien fue tripulante."
