,title,text
0,Violencia de género se toma el debate en juicio oral por crimen,"Con los alegatos de apertura, la extensa intervención del acusado y los antecedentes aportados por dos testigos comenzó ayer el juicio contra un isleño acusado de asesinar a su expareja en la isla Caguach, comuna de Quinchao. Una audiencia por femicidio en que el encartado se expone a la máxima pena de nuestra legislación. La sesión telemática, marcada por los rigores de este sistema, como interrupciones de conectividad, se inició ante la sala del Tribunal Oral en lo Penal de Castro, presidida por el magistrado (s) Elías Agüero, con los planteamientos de los cuatro acusadores y la defensa del sujeto de iniciales C. I. V. V. (45), sindicado como autor del crimen contra Mónica Mansilla Muñoz (54), cuyo cadáver fue hallado en su domicilio el 19 de diciembre del 2019. El fiscal Luis Barría, quien instruyó las diligencias del caso, partió sus alegaciones remarcando que el delito por el cual presentó cargos ""no es solo uno de los más graves de nuestra legislación, sino que también es el mayor que atenta contra las mujeres por violencia de género"". Para sustentar esta perspectiva, el persecutor remarcó que el encartado por ""17 años estuvo en conviviencia con la víctima, tiempo en que se registraron hechos de violencia intrafamiliar (VIF), tanto de amenazas como lesiones"", siendo denunciados, uno en sede de Familia y otro en Garantía. Además, el abogado resaltó que en noviembre del 2019 ocurrió otra embestida que marcó el término definitivo de la relación y la salida del hogar común del isleño. ""El acusado persiguió con un arma blanca a la víctima, quien debió esconderse en un puente"", relató. Es más, la fuente expuso que la noche anterior al crimen la vecina participó de una fiesta. ""El imputado estaba en el lugar y estimamos que quizás, al ver que la mujer estaba rehaciendo su vida, se gatilló este último episodio de violencia"", acotó. Durante su presentación, el fiscal describió el deceso de la pobladora, su hallazgo y posterior pesquisas de la Brigada de Homicidios (BH): ""Quedó en evidencia la intervención de terceros y los indicios de estrangulación"". Los antecedentes que vincularon en el ilícito al sujeto, como especificó Barría, habrían surgido de las primeras diligencias policiales (pericias a una camioneta y levantamiento de restos biológicos de prendas de vestir cotejados), como las contradicciones en el relato del isleño. A ello, se sumó el aporte de testigos, incluso ""lo ven ingresando al domicilio de la víctima durante la mañana (del día del crimen), siendo esta una prueba directa"", explicó. En base a esta prueba reunida, el jurista aseveró que ""lograremos acreditar el delito de femicidio y la participación del acusado, quien prestó declaración negando su intervención"". Por su parte, el abogado Patricio Olivares, quien representa como querellante a Iván Aro, hijo de la víctima, expresó en la audiencia que en este caso ""existió violencia de género sistemática en el tiempo"", sumando que ""por parte del acusado existe un desprecio a la vida de la víctima, que nace por su sentido de propiedad que tenía hacía ella"". Agregó el profesional que en base a las dos agravantes que invocó (abuso de las fuerzas y haber actuado en la morada de la víctima) ""queda de manifiesto este cruel y cobarde ataque"". Además, indicó que la pena de presidio perpetuo calificado que solicitó, como el resto de los acusadores, se sustenta en marcos legales sobre la violencia de género, como la Convención de Belem do Pará. En tanto, el asesor legal del Servicio de la Mujer y Equidad de Género (SernamEG) Los Lagos, Thomas Patri, expuso que todo el contexto de este femicidio ""demuestra como el acusado cosifica totalmente a la víctima, abusando de sus fuerzas y actuando con total desprecio de la dignidad de la mujer"". Junto con coincidir en los alcances de violencia de género en este caso, el querellante insistió en que pese a no existir denuncias de las embestidas anteriores contra Mansilla, ""el acusado siempre fue violento con ella, en una dinámica que es típica en estos hechos, donde las agresiones van en escalada"". Corrigió que la vecina ""no murió, sino que la mataron"". Tania Sánchez, abogada del municipio de Quinchao, quien representa a Marcia Aro, otra hija de Mónica Mansilla, coincidió en la recurrencia de la VIF que terminó en el fatal ataque. ""El acusado no respetó el derecho de la víctima de vivir libre de violencia y terminó con su vida"", dijo. Añadió la fuente que ""el dolor de sus tres hijos no tiene reparación alguna, quedaron sin madre, sin el eje de la familia por la acción del imputado"", hechos que catalogó como un delito de parricidio. Igualmente, el defensor particular Andrés Firmani insistió en la postura que ha mantenido desde que tomó la representación del encartado: asegura su inocencia. ""Mi cliente no mató a doña Mónica, aparte de eso, la prueba que fue recopilada en la investigación y que se conocerá en este juicio adolece de una serie de irregularidades. Hemos advertido en diferentes audiencias sobre la pureza de la prueba, la ilegalidad de las evidencias obtenidas"", explicó el penalista. Asimismo, el profesional sostuvo que la falta de participación del isleño ""no solo se da porque niega haberle quitado la vida a quien fue su conviviente por más de 17 años, sino que los meros indicios recopilados fueron creados para imputar al único sospechoso de esta causa"". Tras las alegaciones de los intervinientes declaró el acusado y luego comparecieron dos testigos. Para esta jornada sigue la exposición de los medios probatorios del Ministerio Público. ""La comunidad de Caguach y familia de Mónica no serán las mismas por esta muerte. La extensión del mal causado será fundamental para sustentar una pena ejemplar"". Thomas Patri,, querellante por el SernamEG. El acusado declaró vía remota desde la cárcel de Castro, donde se encuentra cumpliendo con la cautelar de prisión preventiva. Tras remarcar que no participó en el asesinato de la víctima, finalizó enfatizando que ""no la maté, yo no soy para eso"", dentro de una intervención en la cual su abogado Andrés Firmani buscó desvirtuar la evidencia de los acusadores. Como esgrimió el penalista, ""existió vulneración de garantías en el levantamiento de prendas de vestir"", en la casa donde estuvo viviendo el isleño previo a su detención. Es más, recalcó que la propia tía de su cliente firmó el acta para autorizar esta pericia. Además, en el inicio de este análisis probatorio se buscó por la defensa desacreditar al testigo que señaló haber visto entrar a la casa de la mujer al imputado, como también se esbozó que un tercero no identificado pudo cometer el hecho. 27 de febrero del 2020 fue la detención del sujeto, tiempo desde el cual está privado de libertad. 24 lesiones constató el Servicio Médico Legal en el cuerpo de la víctima tras la autopsia. 11 peritos fueron fijados por los acusadores para detallar las diligencias de esta causa. 40 años efectivos de cárcel contempla la perpetua calificada, antes de optar a beneficios."
1,"Denuncias por delitos sexuales aumentan 27,7% en Chiloé","La Policía de Investigaciones (PDI) a nivel nacional entregó en los últimos días un preocupante estadístico a nivel nacional: las denuncias por delitos sexuales aumentaron un 24,7 por ciento durante el primer semestre, con relación al igual periodo del 2020. El confinamiento durante la pandemia del covid-19 se vislumbró como uno de los factores gatillantes de esta cruda realidad. El jefe de la Brigada Investigadora de Delitos Sexuales (Brisex) Metropolitana, Manuel Fuentes, señaló que ""son las personas más cercanas (los autores), entonces al estar confinado víctima y victimario, conviven en el mismo espacio físico (…) lo que podría ser una causa del aumento de las denuncias, porque han ocurrido más hechos en este contexto"". Esta dinámica golpea incluso con más fuerza a la provincia, donde estos aberrantes ataques están enquistados en la sociedad. Según los antecedentes que entrega el Centro de Estudios y Análisis del Delito (CEAD) de la Subsecretaría de Prevención del Delito del Ministerio del Interior, durante los primeros seis meses de este 2021 las notificaciones por estos ilícitos de connotación sexual se incrementaron en un 27,7%, en comparación con el año pasado. Denuncios por 30 violaciones y 76 abusos y otros ilícitos relacionados, se contabilizaron en este periodo, a diferencia de los 83 totales que el 2020 fueron informados a las policías. Con relación a casos policiales, que junto a las denuncias incluye las detenciones flagrantes, el alza en el primer semestre de esta temporada llegó a un 24,2%. En el marco de este escenario, el jefe de la Brisex de Ancud, el subprefecto Mauricio Espinoza, enfatizó que esta unidad especializada ""registró una leve alza respecto a la cantidad de denuncias realizadas en el primer semestre de este año, en comparación al mismo periodo del año 2020"". Aclaró el oficial que ""de acuerdo a las estadísticas internas de la PDI, se trata de hechos de connotación sexual ocurridos en la provincia, destacando el abuso sexual de menor de 14 años como el delito con mayor cantidad de denuncias, tanto en el 2020 como el 2021; seguido por el delito de violación de menor de 14 años, realidad que se replica con las cifras existentes a nivel nacional"". Respecto de las órdenes de investigar recibidas por la Brisex, ""estas pasaron de 158 decretos durante el primer semestre del 2020 a un total de 162 durante el mismo periodo del presente año"". Bajo este contexto, el jefe policial hizo un llamado a la comunidad a dar cuenta de estos ilícitos, ""acercándose tanto a los cuarteles de la PDI de Ancud, Castro y Quellón, como también a cualquiera de las fiscalías locales de Chiloé"". Por su parte, esta tendencia al alza igual se observa en el resto de este año en la jurisdicción más populosa de Carabineros: la Segunda Comisaría de Castro, que junto a la capital chilota incluye a las comunas de Dalcahue, Chonchi, Puqueldón, Curaco de Vélez y Quinchao. Según los datos que entrega el Sistema Táctico de Operación Policial (STOP), hasta el 29 de agosto pasado, se observó un incremento del 36% de los casos policiales por violación. Junto con explicar que esta alza se grafica en cuatro hechos más durante este periodo del 2021, con relación a igual lapso del 2020, el mayor Gustavo Guajardo, titular de la unidad base, enfatizó que ""uno de los factores que podrían explicar este aumento está dado en que se han denunciando más hechos en este tiempo, por delitos que ocurrieron en años anteriores"". ""El abuso sexual de menor de 14 años es el delito con mayor cantidad de denuncias, tanto en el 2020 como el 2021; seguido por el de violación de menor de 14 años"". Mauricio Espinoza,, jefe de la Brisex de Ancud. La Fiscalía Regional de Los Lagos también informó de alzas relativas a delitos de connotación sexual, en cuanto a salidas judiciales, que alcanzaron durante el primer semestre de este año un 49%, situando a Los Lagos como la región con el más alto porcentaje en el país con relación a sentenciadas condenatorias, suspensiones condicionales u otras formas de término de estas causas. 106 notificaciones por delitos sexuales se registraron el primer semestre de este año."
2,Protestan por crimen de mujer que quedó impune en la isla Caguach,"Con la movilización de un centenar de personas, proveniente de distintos puntos de la zona, se realizó durante la tarde de ayer en la capital chilota una manifestación en rechazo a la absolución del único acusado del crimen de Mónica Mansilla Muñoz (54), ocurrido en la isla Caguach, comuna de Quinchao. Una causa por femicidio que quedó impune, generando impacto en la comunidad local. Las agrupaciones Feministas Autoconvocadas Archipiélago de Quinchao y Mestizas, junto a la familia de la víctima organizaron esta marcha que salió desde la Plaza de Armas de Castro y recorrió calles céntricas para enfilar hasta el frontis del Tribunal Oral en lo Penal (TOP), donde aguardaron por la lectura de sentencia, que confirmó esta decisión absolutoria. Enarbolando banderas y pancartas, junto a cánticos los manifestantes, en su mayoría mujeres, expresaron su indignación por este dictamen. Acusaron derechamente que la justicia les falló, dejando en libertad al imputado de iniciales C. I. V. V. (45), sindicado como autor del asesinato el 19 de diciembre del 2019. Según lo expuesto por Marcia Aro, hija de la vecina hallada sin vida en su propio dormitorio, la respuesta de la comunidad a su causa siempre ha sido masiva. ""Todos han creído en nosotros y piensan que esto es una verdadera injusticia"", apuntó la joven. Añadió quien también es querellante en este caso que ahora ""los pasos a seguir serán analizar el fallo, tenemos 10 días para interponer el recurso de nulidad, puesto que las pruebas que se reunieron existen y son suficientes para acreditar el femicidio... Los jueces que hagan bien su trabajo, puesto que parece que les quedó grande el caso"". Por su parte, Isabel Aro, la otra hija de la víctima, reconoció que al escuchar el veredicto de la sala presidida por el magistrado (s) Elías Agüero, todos quedaron ""congelados"". Agregó que a todos los cercanos les embargó ""una angustia, se nos estremeció el corazón, puesto que no puede ser que un asesino quede suelto. Él es un peligro para cualquier mujer y nosotros"". Justificó esta posición, remarcando que el imputado ""siempre fue agresivo cuando tomaba, es una persona muy mala y me duele que ahora esté libre"". Además, advirtió a todas las afectadas de violencia intrafamiliar como su madre, ""que denuncien oportunamente y no se retracten, hay que seguir hasta el final"". Al igual que sus hermanas, Iván Aro no dudó en señalar que ""buscaremos en la Corte de Apelaciones que se anule el juicio y demostrar que esta persona asesinó a mi madre"", en un caso que horrorizó por el grado de violencia empleado, puesto que la isleña fue estrangulada y, según la autopsia, sufrió a lo menos 24 lesiones, tanto a nivel facial, abdominal, torácico, dorsal y en las extremidades. El que un crimen de esta naturaleza quede sin sanción refleja una falla total del sistema. Así lo planteó Carmen Barría, quien llegó desde Achao y manifestó que ""convocamos a esta iniciativa para visibilizar a toda la sociedad chilota que este no es un hecho aislado. Hay una sensación de indignación puesto que cada vez que se asesina o viola a una mujer no hay procedimientos limpios. La justicia no funciona"". Sumó la fuente que ""tenemos rabia de que vivimos en una sociedad patriarcal, violenta, en que cada día hay más casos de violencia intrafamiliar"". Por su parte, Jessica Millalonco, de la Agrupación Mestizas, señaló que ""esta causa nos mueve a raíz de la negligencia por parte de la policía frente a la investigación. Nos molesta, nos duele que otra vez un femicidio quede en la impunidad""."
3,TOP absuelve a acusado de femicidio: crimen en isla Caguach queda impune,"Calificando la investigación como ""deficiente"", incluso con actuaciones policiales vulneratorias, durante la tarde de ayer el Tribunal Oral en lo Penal (TOP) de Castro absolvió al sujeto acusado de asesinar a su expareja en la isla Caguach, comuna de Quinchao. Un caso por femicidio en que el isleño arriesgaba cadena perpetua calificada, pero que con esta decisión quedó impune. La sala presidida por el magistrado (s) Elías Agüero, después de ocho jornadas de audiencia, entregó su veredicto unánime en el que acreditó que la jornada del 19 de diciembre del 2019 Mónica Mansilla Muñoz (54) fue agredida al interior de su domicilio con golpes de puños y patadas, hasta ser estrangulada perdiendo la vida por asfixia. Además, en su exposición el juez presidente remarcó que este ""es un hecho de violencia extrema"", en el cual se analizaron los antecedentes con una perspectiva de género, incluyendo la normativa internacional como la Convención de Belem do Pará. Sin embargo, no se logró atribuir la autoría en este ataque al encartado. ""Los acusadores no incorporaron en el juicio los elementos de prueba para situar al acusado en el sitio del suceso, más que los dichos de un testigo, en un horario que no se condice con la data de muerte ni con la naturaleza y multiplicidad de lesiones que sufrió la víctima"", dijo el sentenciador. Es más, la fuente en su lectura recalcó que la evidencia presentada ""solo consistió en antecedentes indiciarios"" entregados por la policía, los cuales ""no resultaron idóneos ni eficaces"". Incluso, agregó que la labor investigativa presentó ""serias deficiencias y debilidades"", no permitiendo situar en el lugar al acusado y atribuirle participación. Bajo este escenario, los magistrados desecharon los cargos contra el isleño, alzando de manera inmediata la prisión preventiva que pesaba en su contra desde comienzos de marzo del 2020. La decisión se enmarcó en los postulados que presentó el defensor particular Andrés Firmani, quien cuestionó desde los albores de su representación, el despliegue realizado por la Brigada de Homicidios (BH) de Puerto Montt. Sostuvo el jurista en sus alegatos que los medios probatorios ""son contradictorios y generan más dudas que certezas"", ejemplificando que un perito describe que la data de muerte de la víctima sería las 4 de la madrugada, ""pero no existe prueba alguna que demuestre que el imputado estuvo a esa hora en el domicilio"", aclaró. Asimismo, explicó el penalista que ""la contaminación del sitio del suceso es grosera y no puede arrojar prueba valorable"". No dudó en señalar que ""se hizo todo mal en este procedimiento policial"". Igualmente, el profesional esbozó la vulneración de garantías constitucionales de su cliente, lo cual igual fue estimado por los juzgadores, en especial en cuanto al levantamiento de evidencia. ""Estamos hablando de una causa por femicidio, en la cual el estándar de la prueba debe ser mayor, sin contradicciones ni omisiones. Pero acá hubo horrorosas infracciones: contra la intimidad de mi representado, como al debido proceso"", indicó Firmani, señalando que se incautaron ropas y el cinturón del isleño desde su pieza, ""sin existir un contexto de flagrancia e ingresando a su pieza sin su autorización"". Por su parte, esta resolución marca un verdadero mazazo para los acusadores que invocaban la máxima sanción de nuestra legislación. De acuerdo a lo expuesto por el fiscal Luis Barría durante la audiencia, la prueba era suficiente para acreditar el tipo penal como la intervención del imputado, primordialmente por los datos entregados por un testigo presencial que habría visto ingresar al sujeto a la casa de su exconviviente. A ello, sumó los datos policiales, periciales y evidencia científica, como un comparativo de ADN de dos pelos levantados del cinturón del acusado, que correspondían a la mujer. Más allá de esta decisión, el persecutor precisó que se esperará la lectura de la sentencia programada para este martes, ""para analizar los eventuales recursos a interponer en atención a los fundamentos que tuvo el tribunal para absolver"". También espera analizar a fondo este fallo el abogado Patricio Olivares, quien representa como querellante a Iván Aro, hijo de la víctima. Eso sí, advirtió que recurrirá ante la Corte de Apelaciones de Puerto Montt. ""Resultan vergonzosas las eventuales bases que tuvo el tribunal para absolver a una persona que comete un delito atroz. Hay que esperar la sentencia para estudiar el contenido de la misma y recurrir de nulidad, a fin de revertir este resultado que en nada ayuda a la reparación de la familia ni mucho menos a la seguridad de la comunidad"", explicó el jurista. Añadió la fuente que ""en ese orden de ideas no comparto los argumentos normativos vertidos por el tribunal, ya que ni siquiera la defensa rinde prueba al respecto, lo que deja de manifiesto el actuar garantista del tribunal"". Thomas Patri, abogado del Servicio de la Mujer y Equidad de Género (SernamEG) de Los Lagos, en representación de Isabel Aro, como Tania Sánchez, querellante por Marcia Aro, igual esperan estudiar a fondo la sentencia para evaluar acciones legales posteriores. ""Agotaremos todas las instancias legales para encontrar justicia para mi mamá"". Iván Aro,, hijo de la víctima Como un ""balde de agua fría"" calificó esta decisión Iván Aro, hijo de la víctima, quien aseguró que ""con toda la prueba que existía no puede ser que esta persona quede en libertad"". Remarcó que ""había antecedentes más que suficientes para condenar, pero parece que poco más mi mamá tenía que grabarse mientras la agredían para poder comprobar todo"". El joven enfatizó que como familia se sienten desprotegidos tras el levantamiento de cautelares del acusado. ""Tenemos miedo de que pueda atentar contra algunos de nosotros"", resaltó, sumando que recurrirán de nulidad para revertir el fallo."
4,Ministra y familia piden las máximas penas por femicidio,"Con más de 90 medios probatorios disponibles mañana comienza el juicio virtual contra un sujeto que enfrenta cargos por femicidio, al ser sindicado como el responsable de matar a su expareja en la isla de Caguach, comuna de Quinchao. El acusado arriesga una pena de cadena perpetua calificada por este horrendo crimen. La sala presidida por el magistrado (s) Elías Agüero del Tribunal Oral en lo Penal de Castro analizará los antecedentes de este caso que se remonta al 19 de diciembre del 2019, cuando al interior de su dormitorio fue hallado el cadáver de Mónica Mansilla Muñoz (54). Quien fue su conviviente por 17 años, de iniciales C. I. V. V. (45), es sindicado como el responsable del asesinato. Durante la audiencia que se prolongaría por toda la semana se espera revivir los impactantes hallazgos que estremecieron a toda la comunidad insular. Incluso, este hecho tuvo repercusiones nacionales, más al quedar en evidencia la magnitud del ataque a la víctima: la vecina fue estrangulada y según la autopsia sufrió a lo menos 24 lesiones, tanto a nivel facial, abdominal, torácico, dorsal y en las extremidades. Incluso, la misma ministra de la Mujer y Equidad de Género, Mónica Zalaquett, se refirió en su visita a la Isla a esta causa, aguardando por el máximo rigor de la ley. ""Como ministerio siempre hacemos un llamado para que se apliquen las condenas máximas para este tipo de caso. Insisto, tenemos que ser enfáticos y dar una señal clara a la sociedad que estos hechos no pueden seguir sucediendo. Y para ello, se requiere de las penas máximas y las sanciones sociales máximas"", remarcó la secretaria de Estado. El fiscal Luis Barría instruyó las diligencias de la causa, las que corrieron por parte de la Brigada de Homicidios (BH) de Puerto Montt, con el apoyo científico del Laboratorio de Criminalística (Lacrim), también de la policía civil de la capital regional. Como esgrimió en su momento el persecutor, los abundantes medios probatorios serían ""suficientes para acreditar el delito y la participación del acusado, como también esperamos sustentar la pena que invocamos"". La sesión judicial iniciará a partir de las 9 horas de este lunes, con los alegatos de apertura de los numerosos intervinientes. Al Ministerio Público se suman como querellantes (por los hijos de la víctima), el Servicio de la Mujer y Equidad de Género (SernamEG) de Los Lagos, con su abogado Thomas Patri en representación de Isabel Aro; el jurista Patricio Olivares asesora a Iván Aro, y Tania Sánchez del municipio quinchaíno es acusadora por Marcia Aro. Todos coinciden en el concurso de una serie de agravantes, como el abuso del delincuente de la superioridad de su sexo o de sus fuerzas, y ejecutar el hecho con desprecio a la dignidad de la víctima o en su morada. Bajo ese prisma, esperan crear convicción en los jueces para que se imponga la máxima pena de nuestra legislación. Por su parte, el defensor particular, Andrés Firmani, ha trabajo con detalle la postura que busca plasmar ante los sentenciadores. Sin embargo, el penalista ya había adelantado que toda la información reunida en más de un año de indagatorias no cumple el estándar para configurar prueba de cargo. ""No se puede acreditar más allá de toda duda razonable la responsabilidad de mi cliente en los hechos. Estoy convencido que es inocente y que aquí hay un escenario de prueba absolutamente insuficiente y contradictorio"", puntualizó la fuente. Iván Aro, hijo de la víctima y quien es querellante en esta causa, se reunió esta semana con su abogado para preparar el juicio oral en que es testigo. El joven reconoce que en esta audiencia ""se abrirán muchas cicatrices, al recordar la forma en que murió mi mamá"", pero enfatizó que es una instancia necesaria para encontrar justicia. ""Todo ha sido muy agotador dentro de este proceso, pero se debe hacer para acreditar la gravedad de este crimen y que se puedan otorgar las penas máximas"", explicó. Asimismo, la fuente destacó que ""en todo este tiempo hemos recibido muchas muestras de apoyo, las cuales nos dan la fuerza para seguir adelante, buscando que mi mamá tenga justicia. Nadie quedó indiferente por lo que sucedió, más en un lugar como Caguach, la Isla de la Devoción como le dicen... todos sufrieron el impacto por este hecho"". 33 testigos fijó el fiscal de la causa para este juicio oral que será vía telemática. 18 meses lleva privado de libertad el acusado por este crimen en la isla quinchaína."
