,title,text
6,A prisión preventiva sujeto acusado de violar reiteradamente a su hija,"Un sujeto quedó en prisión preventiva luego de ser encausado por la Fiscalía de Castro por el delito de violación reiterada de su hija, una menor de 12 años de edad. El imputado fue sorprendido en la comisión del delito, tras lo cual huyo de la vivienda ubicada en el sector La Chacra, en la comuna de Castro. Tras cursarse la respectiva denuncia ante el Ministerio Público se tramitó una orden de detención su contra, que fue materializada en la comuna de Dalcahue, cuando esperaba locomoción en el sector de Mocopulli. Por el momento el imputado deberá esperar privado de libertad la investigación que se inició en su contra, por lo que serían reiteradas agresiones sexuales en contra de la menor cuando quedaba a su cuidado. DETENCION Según la información emanada desde la policía, la detención del sujeto se registró en el sector de las Frutillas, en la comuna de Dalcahue. Esto luego que personal de la Tenencia de Carabineros del puerto fuera alertado de la presencia del sujeto en las inmediaciones del lugar. Al llegar al lugar el personal policial pudo comprobar que la persona reunía las características de quien era sindicado como autor de la violación, por lo que se procedió al control de identidad del sujeto. Fue el Mayor de Carabineros de la Segunda Comisaria de Castro, Gustavo Guajardo quien señaló que los efectivos policiales lograron dar con el paradero del individuo, luego que una persona que se encontraba en el lugar reconocerá al sujeto que tenía ya una orden de detención en su contra. “El individuo estaba esperando locomoción colectiva y se logró su identificación, a través de la consulta efectuada de sus antecedentes policiales se percata, el personal policial, que mantenía una orden de detención vigente del Juzgado de Garantías de Castro por este delito”, expresó. FORMALIZACION En este contexto, el Fiscal de Castro Enrique Canales, informó que el sujeto es padre de la niña de 12 años y que tras su captura fue formalizado por el delito de violación de menor de edad. “Afectó a una niña, en dicha ocasión el sujeto sindicado como autor del estos hechos, que es el padre de la niña, huyó del lugar al ser sorprendido, por lo que con las primeras diligencias realizadas por la Brisexme de la PDI, se logró obtener una orden de detención la que se hizo efectiva”, apuntó. El fiscal agregó que “fue formalizado en el Tribunal de Garantías de la ciudad de Castro por el delito reiterado de violación de persona menor de 14 años.  Se decretó su prisión preventiva”, expresó. De esta manera, el sujeto fue ingresado al Centro de Detención Preventiva de Castro mientras dure la investigación, para lo cual se indicó un plazo de 90 días."
7,Joven admite 5 delitos de VIF contra su expareja y accede a pena remitida,"En una gráfica muestra de los alcances de la violencia intrafamiliar (VIF), donde pese a una serie de episodios de agresividad la víctima se retracta, un sujeto fue sentenciado en las últimas horas por cinco delitos en perjuicio de una joven de 24 años. Sin embargo, los intervinientes habrían reiniciado su relación. La espiral de violencia no sólo fue expuesta en el Juzgado de Garantía de Castro, sino que también fue reconocida por el imputado, identificado con las iniciales F. M. R. A. (27). Por ello, accedió a un procedimiento abreviado que le permitió recibir una exigua sanción. Durante la audiencia remota, se acreditó que el encartado atacó el 18 de junio del 2019 a la madre de su hijo, con quien convivía en una casa del sector Mocopulli, comuna de Dalcahue. La expulsó del domicilio y la amenazó con matarla con un cuchillo. Pese a que un mes después se le impuso al oriundo de Maullín una prohibición de acercarse a la ancuditana, el obrero quebrantó la medida apenas dos días después de ser decretada. Y no solo eso, el 1 de agosto de ese año, volvió a irrumpir contra la afectada en la localidad de Pid Pid (Castro), a quien persiguió en una camioneta y la intimidó. Esta secuencia fue admitida sin reparos por el acusado, más allá de la prueba reunida en su contra, primordialmente testimonial. De esta forma, la magistrada Jesica Yáñez terminó por condenarlo a 41 días de prisión por un delito de lesiones menos graves, dos de amenazas (41 días por cada ilícito) y a dos penas de 300 días de reclusión por igual número de desacatos, todo en contexto de VIF. No obstante, estas sanciones corporales fueron sustituidas por una pena única de 2 años de remisión condicional, quedando sujeto a los programas del Centro de Reinserción Social (CRS) de Gendarmería. A esta resolución se llegó por el acuerdo previo entre los intervinientes, lo cual se posibilitó, como explicó el fiscal Luis Barría, por la circunstancia que el imputado tenía irreprochable conducta anterior. La atenuante sumada a la colaboración sustancial, por aceptar el abreviado, permitió este dictamen. ""Como el imputado no registraba condenas anteriores se le concedió la remisión condicional, con la accesorias legales típicas de los delitos de VIF"", apuntó el persecutor, aclarando también que se analizará si se mantiene la prohibición de acercamiento. Hasta mañana tiene plazo el Ministerio Público para informar al tribunal esta situación. ""El imputado y su defensa manifestaron que se habría reanudado la vida en común entre el acusado y la víctima, lo cual se debe hacer presente una vez que se confirme este escenario. De ser admitido por la afectada, evaluaremos otra medida accesoria que puede ser algún tipo de tratamiento"", recalcó el jurista. Por su parte, el defensor Juan Manuel Castro, resaltó este término judicial, enfatizando que ""los casos se estaban indagando por forma separada, pero al tratarse de una misma víctima e imputado, se decidió por el fiscal agrupar todo en una causa. De ahí se exploró el abreviado que se aceptó, llegando a una pena única"". Asimismo, el profesional coincidió en que se llegó a este dictamen por la irreprochable conducta anterior de su representado, sumando que el joven ""valoró este fallo y ahora sólo está pendiente si se levanta la accesoria""."
8,"Después de 5 semanas en fase 2, Puerto Montt vuelve a cuarentena","A un mes y siete días de haber avanzado a fase 2 (Transición) en el plan Paso a paso, la comuna de Puerto Montt nuevamente volverá a cuarentena a contar de las cinco de la mañana de este jueves 14. La decisión fue comunicada ayer por la subsecretaria de Prevención del Delito, Katherine Martorell, durante un punto de prensa realizado en La Moneda, ocasión en la que detalló que también retroceden a confinamiento total las comunas de Puerto Varas y Calbuco, en la Provincia de Llanquihue; así como Castro, Ancud, Dalcahue y Quellón, en la de Chiloé; además de Osorno, en la provincia del mismo nombre. Asimismo, desde la misma fecha la comuna de Hualaihué, en la Provincia de Palena, deja de estar en fase 4 (Apertura inicial) y queda en la etapa 2. Al analizar el escenario regional, el doctor José Antonio Vergara, epidemiólogo de la Seremi de Salud, partió reconociendo que ""estamos en una situación muy crítica"". Definió que el criterio principal que se ha empleado en esta oportunidad es la incidencia de nuevos casos. ""Hay comunas que están teniendo tasas de incidencia muy altas, que se traduce, por ejemplo, en la mantención de casos activos en un volumen muy importante, que a su vez son fuente de nuevos casos"", dijo. Según el informe de la Seremi de Salud, Puerto Montt reportó ayer 188 nuevos casos, para acumular 10.496 desde el comienzo de la pandemia. En cuanto a sus casos activos, totaliza 919, de los 1.516 de la Provincia de Llanquihue. Vergara añadió que el número reproductivo efectivo regional es de 1,29 ""superior incluso al de la Región Metropolitana"", por lo que argumentó que la medida de cuarentena total ""se hizo imprescindible en el escenario actual"". Ante una consulta, el epidemiólogo sostuvo que la situación de las comunas que retroceden a cuarentena ""es homologable"" al estado regional, ""con un incremento importante en la incidencia de casos y en la tasa de prevalencia de casos activos, que se transforman en una fuente potencial de nuevos casos"". El doctor Vergara argumentó que el ascenso de la frecuencia de aparición de casos nuevos ""tiene que ver con las comunas que son más populosas, en función de las masas de población entre las que el virus tiende a circular. La conurbación que existe entre Puerto Montt y Puerto Varas es un ejemplo del intenso intercambio de personas durante todo el día, entre ambas comunas "", apuntó. El secretario regional ministerial (seremi) de Salud, Alejandro Caroca, aseveró que ""cada uno de nosotros ha fallado"" en cuanto a mantener las medidas preventivas de contagio, como el uso adecuado de la mascarilla, mantener el distanciamiento social y el frecuente lavado de manos. ""El comportamiento de la población no ha estado a la altura"", añadió, lo que ha implicado -sostuvo- tener que implementar medidas de restricción del movimiento y libertades. Sobre la implementación de esta segunda cuarentena, el seremi Caroca resaltó que a diferencia de la primera, que se extendió por 4 meses y 6 días, el nuevo plan Paso a paso anunciado ayer por el gobierno, definió que estos confinamientos no se extenderán más allá de cuatro semanas. Caroca comentó que podría levantarse esta restricción, lo que depende la tendencia que muestren los contagios y las cifras. ""Lo peor que nos podría ocurrir como comunidad es que al cabo de un mes sigamos igual o peor (...). Sería fantástico a lo mejor estar en dos semanas más anunciando que lo hemos hecho tan increíble, cada individuo de nuestra comunidad, que podamos retrotraernos a una situación mejor"", aventuró. Cuando se le preguntó si las cuatro semanas definidas es el límite definitivo, aunque no haya variación favorable de los indicadores sanitarios, enfatizó que ""la idea de las medida de cuarentena acotada es cortarla a contar de la cuarta semana"", aunque se podría prolongar si es que se evidencia ""una situación más dramática aún; es decir, en extremo complejo que esperemos que -obviamente- no lleguemos"". Anticipó que habrá fiscalizaciones internas en cada ciudad y que implementarán cuadrillas especiales junto a las Fuerzas Armadas y Carabineros ""que van a ir de manera aleatoria buscando centros (de aglomeración de personas), con la finalidad de ir disminuyendo la movilidad"". Advirtió que serán inflexibles en cuanto a la verificación de los requisitos de desplazamiento, lo que implicará sumarios sanitarios y sanciones, en lo que no descartó proceder a la respectiva detención. En cuanto a las actividades permitidas en cuarentena, el seremi de Salud especificó que sólo estarán autorizadas las de rubros esenciales, con el debido permiso único colectivo. ""Independiente que las personas cumplan con la normativa vigente (permiso colectivo), vamos a realizar investigaciones para certificar la veracidad"", por lo que recomendó incentivar el teletrabajo. Los actuales indicadores han provocado una fuerte tensión de la red asistencial, lo que se ha visto reflejado en que ayer sólo había 3 camas UCI disponibles en toda la región, así como 14 ventiladores mecánicos para ser utilizados. El doctor Jorge Tagle, director del Servicio de Salud del Reloncaví, sostuvo que las unidades vacantes corresponden a la Clínica Alemana de Osorno y a los hospitales de Castro y de Puerto Montt. El coordinador regional de ""La conurbación que existe entre Puerto Montt y Puerto Varas es un ejemplo del intenso intercambio de personas durante todo el día"" José Antonio Vergara,, epidemiólogo de la Seremi de Salud. ""Lo peor que nos podría ocurrir como comunidad es que al cabo de un mes sigamos igual o peor"" Alejandro Caroca,, seremi de Salud. la red asistencial subrayó que ""estamos viviendo la situación más compleja en toda la pandemia"". Tal preocupación se extiende a los 228 enfermos covid que están hospitalizados en la región, de los cuales 117 están en el HPM, donde hasta las 11 horas de ayer, había 25 contagiados en la UCI, 21 de ellos conectados a ventilación mecánica invasiva. La directora de ese centro asistencial, Mónica Winkler, reconoció que hubo 11 ingresos de pacientes covid en las últimas 24 horas y que 50 de esos pacientes ocupan camas críticas, de las que existen 37 camas UCI adulto y 61 UTI. Ante este panorama, admitió que están tomando medidas ""para seguir avanzando en la complejización de camas durante esta semana y así sumar tanto cupos UCI como cupos UTI en los próximos días"". A ello sumó que resolvieron suspender las cirugías electivas, ""excepto las de tiempo sensible como el cáncer""; y que difieren prestaciones ambulatorias que no sean de primera necesidad, salvo el Policlínico de Tratamiento Anticoagulante, el Policlínico de Unacess o enfermedades de transmisión sexual, los controles pos-alta y pos-quirúrgicos, entre otros. Respecto del retroceso a cuarentena, el alcalde de Puerto Varas, Ramón Bahamonde, reaccionó con molestia, especialmente porque no fue informado de la medida. ""Que el señor ministro (Enrique Paris) no le exija a la gente que cumpla medidas restrictivas, cuando ellos no tienen la capacidad ni siquiera de comunicación para tomar medidas (...). Si la gente está violando todas las disposiciones, es porque no han sabido y no tienen los cojones ni la capacidad de tomar soluciones adecuadas"", manifestó. El jefe edilicio reclamó que no hay diálogo ni conocimiento de la realidad de Puerto Varas. ""Lo siento por nuestra gente por quienes crearon una inversión turística y que es tirada por el suelo al minuto. No se puede jugar con la gente"", manifestó. Bahamonde recordó que hace 15 días la subsecretaria de Salud, Paula Daza, analizó con él medidas a implementar ""para que Puerto Varas se incorpore a las políticas de desarrollo del turismo y sea un punto vacacional"". Consideró el anuncio de retroceso a cuarentena ""como un portazo, sin tener la decencia de comunicarse con las autoridades locales y poco respeto al comercio establecido"", ante lo que pidió que ""no nos invadan con violaciones a las disposiciones vigentes, porque la gente ya les perdió la confianza y el respeto a cualquier decisión que puedan tomar, si no hay una comunicación que llegue a la fuente oficial que debe comunicarse con las personas"". 38 días o 5 semanas y 3 días en la fase 2 (Transición) alcanzará a estar Puerto Montt este jueves, cuando comience su segunda cuarentena por covid. 18 semanas y 5 días fue la primera cuarentena en Puerto Montt (29 de julio al 7 de diciembre). Este nuevo confinamiento no debería sumar más de 4 semanas."
9,Escuela Básica Dalcahue lanzó ciclo de charlas virtuales para enfrentar pandemia,"Con la finalidad de seguir brindando apoyo y contención a los estudiantes y sus familias en medio de la crisis sanitaria y social gatillada por el covid-19, la dirección junto a docentes y asistentes de la educación de la Escuela Básica Dalcahue están impulsando diversas charlas virtuales en las que se abordarán distintas visiones para enfrentar la pandemia y el regreso de los alumnos a las aulas. Hace unas semanas, el establecimiento educacional comenzó con este ciclo de charlas virtuales, que, en su primera versión, abordó la temática de cómo enfrentar los delitos sexuales en tiempos de pandemia, actividad que se transmitió a través de las plataformas virtuales del establecimiento y que estuvo dirigido a toda la comunidad educativa y a los vecinos de Dalcahue. En la oportunidad, el jefe de la Brisex de la PDI de Concepción, Javier Muñoz, dictó una exposición en la que expuso sobre los cuidados que deben tener los menores frente al uso de internet para combatir el grooming y las medidas que deben tomar los padres y apoderados para proteger a los niños sobre los nocivos alcances que pueden tener las redes sociales. INICIATIVA Frente a estas acciones impulsadas por el recinto educacional, la directora del establecimiento Yasna Soto indicó que estas instancias permiten abordar ciertos problemas que se generan con la pandemia y al mismo tiempo despejar dudas en torno a cómo enfrentar el retorno a las aulas luego de largos periodos de confinamiento. ""Con estas iniciativas queremos acompañar permanentemente a nuestros estudiantes y sus familias con el objetivo de apoyarlos en medio de los problemas que enfrentamos a diario por el avance del covid. Para nuestra escuela es prioritario el bienestar de nuestros niños, niñas y de sus familias, por eso hemos organizado este ciclo de charlas virtuales que sin duda nos entregarán consejos para afrontar de mejor manera las dificultades que nos impone la pandemia del coronavirus"", recalcó la profesional. La autoridad educativa añadió que todos estos lineamientos y acciones que se han impulsado están dentro del proyecto educativo que impulsa el establecimiento educacional. Por su parte, Guido del Río, encargado del departamento de Convivencia Escolar del recinto, dijo que estas acciones buscan brindar espacios de diálogos con la comunidad educativa y prestar apoyo en estos tiempos complejos que viven las familias por los efectos de la pandemia. ""Esperamos continuar con estas actividades durante el resto del año para compartir información relevante en torno a cómo enfrentar los diversos problemas que se dan en periodos de confinamiento y también fomentar estrategias para el regreso a clases de nuestros estudiantes. Este ha sido nuestro principal foco en el último tiempo"", enfatizó el docente. Desde la dirección de la escuela se informó que dentro de las próximas semanas se continuará con este ciclo de charlas virtuales, en las que se abordarán diversas temáticas relacionadas a cómo apoyar a los estudiantes en esta nueva normalidad post pandemia, velar por la salud emocional en tiempos de pandemia y los desafíos que involucra el regreso a clases para la convivencia escolar, entre otras materias. ""Queremos acompañar a nuestros estudiantes y sus familias con el objetivo de apoyarlos en medio de la pandemia"". Yasna Soto,, directora Escuela Básica Dalcahue"
10,Realizan exitoso operativo de esterilización en Quinchao,"La Municipalidad de Quinchao a través de su Oficina de Medio Ambiente en su línea estratégica de tenencia responsable de mascotas, realizó un importante operativo móvil de esterilización de perros y gatos. Esta actividad gratuita, es el resultado de una alianza entre el municipio y la Agrupación Animalista Darwin de la comuna de Dalcahue, quienes entregaron  cupos a  las distintas comunas de la provincia. Durante los operativos, se contó con un pabellón veterinario móvil que realizó los procedimientos en Villa Quinchao beneficiando a 20 mascotas, mientras que en la ciudad de Achao fueron intervenidos 50 animales, entre perros y gatos. Esterilizar es un beneficio a corto y largo plazo, ya que se evitarán camadas no deseadas, dificultades de parto, enfermedades infecciosas, enfermedades de transmisión sexual y cáncer de mamas, mientras que en machos disminuye su ansiedad y sus ganas de escapar. Desde el municipio se destaca que un factor importante en el proceso de esterilización es disminuir la cantidad de animales abandonados. Perros sin tutela pueden atacar a otros animales, personas y sobre todo a la fauna nativa y silvestre."
11,Indagan a joven por letal estocada al corazón de su hijastro en Mocopulli,"Por 72 horas se amplió la detención de un sujeto vinculado a un incidente que terminó con la muerte de su hijastro, en el sector Mocopulli de Dalcahue. Los informes de la Brigada de Homicidios (BH) y el Servicio Médico Legal (SML) de Ancud serán claves para configurar el tipo penal por el cual será indagado. Los antecedentes que entregó el mismo imputado de 39 años, en compañía de un menor de 13, en la Tenencia de Carabineros dalcahuina, activaron el procedimiento la noche del viernes. Un caso que comenzó, según la denuncia del joven, como un delito de violencia intrafamiliar (VIF) y daños en su contra. Acusó una cuchillada en la espalda y destrozos en su camión. Sin embargo, con los minutos, la información empezó a mutar hasta revelar el deceso de Álvaro Sebastián Raquil Raquil (21), quien fue hallado sin vida a pocos metros del domicilio donde se produjo el altercado familiar. De acuerdo al capitán Gustavo Guajardo, jefe de la Segunda Comisaría de Castro, con jurisdicción en la zona, los hechos se concentraron a la altura del kilómetro 0,5 de la ruta W-45. ""El adulto en la tenencia dijo que se encontraba consumiendo alcohol en una actividad doméstica y que por rencillas previas fue lesionado con arma blanca. Personal de la unidad lo traslada al Cesfam de Dalcahue, en esos instantes se toma conocimiento que apareció una persona fallecida en las inmediaciones del lugar donde ocurrieron los hechos"", describió el oficial. Una patrulla se constituyó en el sitio del suceso con personal de salud y corroboran la información. En la vía pública yacía una persona con una herida cortopenetrante anterior a la altura del corazón. Pese a que se realizaron maniobras de reanimación, en minutos se constató su deceso. Los uniformados entregaron todos los antecedentes al Ministerio Público, que instruyó las pericias iniciales a la Brigada de Investigación Criminal (Bicrim) de Castro. Sin embargo, ante la complejidad del caso, las diligencias quedaron a cargo de la BH. Durante toda la jornada de ayer, los peritos efectuaron pesquisas. Según el comisario Franco Cárdenas, quien encabezó el equipo, el trabajo se complementó con expertos del Laboratorio de Criminalistica (Lacrim), también de Puerto Montt. ""Se está pesquisando un homicidio, logrando determinar la imputabilidad de una persona que corresponde a un hombre de 39 años"", explicó el oficial, añadiendo que la muerte del oriundo de Achao ""se debe a una disputa que dio paso a una pelea, en la cual resultó fallecido"". Con los antecedentes preliminares, se desarrolló durante la jornada de ayer el control de la detención del encartado, en contacto con el Juzgado de Garantía castreño. En la ocasión, la fiscal (s) Carmen Paz Vargas, expuso esta información dentro de la cual se incluyeron los empadronamientos a testigos presenciales, como el examen externo al cadáver. ""Gracias a los datos reunidos se procede a la detención del padrastro de la víctima, alrededor de las 8.30 horas (del sábado), en relación a los antecedentes aportados por la madre del occiso y conviviente del imputado, quien indica que en el marco de una rencilla de ella con su hijo, interviene su pareja, generándose un forcejeo. Señala haber visto al imputado con un cuchillo, el que habría sido arrojado a unos matorrales"", acotó la persecutora. La abogada enfatizó que existen pericias pendientes como la autopsia que se realizaba ayer, el cotejo de un arma incautada en el lugar y la declaración del imputado que será el lunes. Por eso, invocó la prórroga que tuvo la oposición del defensor Juan Manuel Castro. Tal como incidentó el jurista, su representado ""no tiene antecedentes penales y con excepción de su testimonio, ninguna de las otras diligencias que se solicitaron requieren que esté privado de libertad. Además, él se presentó voluntariamente en la Tenencia, por lo que no hay riesgo de fuga"". Pese a estos argumentos, se decretó que el martes sea encausado el isleño. Una audiencia para la cual Castro, de antemano, ya vislumbra su teoría del caso: una legítima defensa. ""El joven que falleció era quien causó los daños en el camión, tenía el cuchillo y le propinó una puñalada por la espalda a mi representado. Después de eso ocurre el forcejeo, caen al suelo y ahí se da la estocada mortal"", dijo el profesional. Por su parte, en medio de este procedimiento, igual fue detenida en un primer minuto la madre del occiso, por presuntas lesiones al menor de 13 años que llegó a denunciar a la Tenencia de Dalcahue. Sin embargo, se constató que estas contusiones habrían sido accidentales, por lo cual fue dejada en libertad. Asimismo, se formalizó por amenazas al hermano del imputado por este crimen, al sindicarle el envío de mensajes de texto intimidantes a la misma mujer. ""Se llegó a una suspensión condicional del procedimiento en ese caso"", aclaró la fiscal (s) Carmen Paz Vargas."
