,title,text
0,Madre de menor abusada sexualmente pide a las familias que realicen las denuncias,"Esta semana se realizará un juicio abreviado por una denuncia de abuso sexual en contra de una menor ocurrida en la comuna de Dalcahue. El sindicado como autor del ilícito es el abuelo de la víctima, identificado como J.R.V.O, quien habría reconocido una serie de agresiones, las que se habrían extendido en el tiempo desde que la menor tenía 9 años de edad. En la familia de la menor hay decepción ya que el proceso abreviado que seguirá la Fiscalía de Castro implicaría que el acusado no recibiría una sanción de mayor cuantía, a pesar del daño generado a la menor. Hoy la madre de la víctima llama a los padres y madres a estar atentos ante cambios de conducta de sus hijos que puedan desvelar que son víctimas de abusos. ABUSOS Deisy Latorre, madre de la niña, señaló  que el acusado habría aprovechado los momentos en que quedaba a su cuidado para perpetrar el ilícito, ya que ambas familias vivían en el sector rural en la época que habrían ocurrido los hechos. Además, el acusado habría mantenido bajo amenaza a la menor para que no contara lo sucedido. “Ella habló en el verano, cuando se dio cuenta que tenía que decirlo, pero él llevaba haciendo esto desde mucho tiempo atrás. Mi hija recuerda desde los 9 años, cuando nos contó tenía 13, pero no tiene recuerdos anteriores”, expresó. Tras la debelación, realizó la denuncia respectiva en la PDI abriendo la investigación que sigue la Fiscalía de Castro por el hecho. “Él lo reconoció y se fue a entregar a la PDI y se abrió el caso y la investigación. El confesó todo, y mucho, a diferencia de lo que me contó mi hija, al aparecer se desahogó en la confesión. En este caso, fuimos nosotros los que tuvimos que salir arrancando de nuestra casa, dejar todo tirado, tratando de resguardar a mi hija, solo pensé en sacarla de ahí”, apuntó. DENUNCIAR Deysi Latorre, señaló que ante de la debelación no notaron ninguna situación o conducta extraña, sin embargo, al conocer los hechos decidieron realizar la denuncia de inmediato. “Por más familia que sea, sea el padre o el hermano, duele mucho, pero hay que hacer los cosas como se deben hacer. Uno no debe taparlo, más cuando se trata de los hijos, o si estás viendo que algo está pasando. Ser cómplice y que se vuelva a repetir. Acá se calla, en Chiloé, mucho esto, especialmente en el campo, pasa mucho”, expresó. Agregó que su hija entró al programa de reparación para víctimas de delitos. “Emocionalmente un día está bien, otro día esta abajo, pasa de extremo a extremo y está en plena adolescencia, es súper difícil, pero ella está con terapia, psicólogo, trabajadora social. Nosotros con mi pareja también estamos recibiendo apoyo”, expresó. En este contexto, señaló que durante el tiempo en que se habrían producidos los abusos, nunca percibió o notó algo extraño. “Pero en el último tiempo mi hija no quería bajar a la casas de los abuelo, cuando tenía 11, 12 años, cuando empezó a crecer, no quería y yo tampoco la obligaba. Pero las veces que estaba solo este hombre con ella o iba mi casa a ayudar en cosas cotidianas aprovechaba de hacer esas cosas con ella. Hubo una reacción tímida, que yo creo que fue la primera alerta”, expresó. Finalmente, Deisy Latorre, señaló que como se trata de un juicio abreviado, las penas a las que se expone son bajas. “Es una burla para mí y mi hija. Si bien la ley dice que un abuso con tocaciones no es lo mismo que una violación, el daño psicológico que hacen a los niños, y el daño emocional es peor todavía. Se dice que ellos pueden avanzar, pero el daño es igual. Tocan a un niño, las penas deberían ser más altas, no por colaborar una rebaja de sentencia, una firma o ayuda comunitaria. Eso hace que vuelvan a cometer lo mismo porque al final la ley no cumple con sancionar fuertemente a los agresores”, expresó."
1,Madre de niñita que sufrió abuso sexual infantil insta a denunciar este flagelo,"Por completo le cambió la vida a una familia chilota al sufrir los alcances de una agresión sexual infantil. Su pequeño tesoro, cuando recién se empinaba por los 8 años comenzó a sufrir los ultrajes del ""abuelastro"". Un delito de abuso reiterado que el mismo depravado reconoció, accediendo a una pena sustitutiva. No fue el término judicial que esperaba la madre de la pequeña, aunque reconoció el valor de una condena en el marco de un flagelo que ella instó a denunciar. Al ser reconocidas las atenuantes de irreprochable conducta anterior y colaboración sustancial, al admitir los hechos de la acusación, el sujeto de iniciales J. R. V. O. (75) accedió a un procedimiento abreviado en el Juzgado de Garantía de Castro, lo que posibilitó ver reducida su sentencia. 3 años de libertad vigilada intensiva dictó la magistrada Jésica Yáñez contra el encartado, como responsable de los aberrantes ataques contra la menor, perpetrados entre el 2015 y diciembre del 2019 en el sector de Chovi San Juan de Dalcahue. Como describió D. L., madre de la víctima, aceptaron esta forma de término ""para no exponer a mi hija a un juicio oral, donde tendría que declarar de nuevo y revivir todas estas cosas"". La fuente detalló que las agresiones se produjeron en el predio que compartían en esta localidad rural. ""Vivimos por 11 años en Chovi San Juan. Nuestra casa y la de él (acusado) estaban cerca, así que coincidían muchas veces, oportunidades en que aprovechaba de abusarla. Ella nos contó en abril del 2020 lo que pasaba, denunciamos de inmediato ante la Policía de Investigaciones (PDI) y a los pocos días nos fuimos de ese lugar"", acotó la vecina, reconociendo que están analizando si su otro hijo menor sufrió también vulneraciones de este anciano. Junto con admitir que este fallo no la deja conforme, la progenitora remarcó que ""esta es la justicia que hay y se debe aceptar"", sumando que también debe existir una sanción social, para lo cual no dudó en advertir a la comunidad sobre estos delincuentes y la necesidad de notificar cualquier agresión sexual infantil. ""La gente debe tener cuidado porque las personas que cometen estos delitos, pueden reincidir. Cárcel deberían tener todos los que cometen estos delitos, puesto que no es justo que queden libres, mientras las víctimas sufren un trauma muy grande, daño que se extiende a toda la familia"", manifestó. Bajo este escenario, su mensaje fue insistir en que ""todos se atrevan a denunciar, que no se callen estos hechos por ser alguien cercano el responsable. Hay mucho miedo también, yo lo tuve, pero el llamado es a ser firmes y dar cuenta de estos casos, puesto que los hijos de uno son lo más importante"". El fiscal de esta causa, Enrique Canales, explicó que se llegó a este abreviado, en consideración a la ""pena asignada al delito, que no sea superior a los 5 años de presidio"", como ocurre con el abuso sexual impropio. A ello, se suma el reconocimiento de los hechos por parte del acusado. Bajo ese escenario, se puede configurar una pena sustitutiva, en la que también inciden ""las circunstancias modificatorias que concurren y su calidad. En esta causa, se consideraron la irreprochable conducta anterior y la colaboración sustancial, lo que permitió llegar a esta sanción"". Pese a ello, el persecutor valoró las penas accesorias dictadas, como fueron ""la sujeción a la vigilancia de la autoridad durante los diez años siguientes al cumplimiento de la pena principal; la inhabilitación absoluta y perpetua para cargos, oficios o profesiones ejercidos en contacto con menores de edad; la prohibición de acercarse a la víctima hasta que esta alcance la mayoría de edad, y la incorporación de la huella genética en el registro nacional de condenados""."
2,Condenan a 3 años de libertad vigilada a sujeto por abusos sexuales reiterados a menor,"A tres a años de libertad vigilada intensiva  fue condenado José René Vidal Osorio, acusado por la Fiscalía de Castro por el delito de abuso sexual reiterado contra una menor de edad. La sentencia se registró tras un juicio abreviado, en el que el imputado reconoció la autoría del ilícito. Recordemos que los hechos se registraron en el sector rural de Chovi San Juan, en la Comuna de Dalcahue, cuando el acusado quedaba a cargo de la menor de edad, quien sufrió abusos en el periodo comprendido entre los 9 y 13 años, tras lo cual decidió debelar lo sucedido a sus padres. Conocida la sentencia, familiares de la menor apuntan a que las penas para este tipo de delitos son bajas e instó a los padres a estar atentos para evitar que sus hijos sean víctimas de delitos sexuales. JUICIO ABREVIADO Junto con la pena principal,  al imputado se le asignaron otras pruebas accesorias, entre las que se cuentan la inhabilidad para ejercer cargos públicos que se relacionen con menores de edad, prohibición de acercase a la víctima hasta que alcance la mayoría de edad y la inclusión de su huella genética en registró nacional de condenados. “La condena es baja, pero es lo máximo que da el sistema de justicia para estos casos. Hay parte de disconformidad, pero ya está condenado, va a cumplir para la justicia una condena. Pero hay que estar con precaución, para que estas personas, que hacen daño a los niños no lo vuelvan a cometer. Me queda la sensación que faltó algo”, dijo Deysi, madre de la menor. Asimismo, hizo un llamado a los papás y mamás en tener precaución, y vigilar respecto de actitudes extrañas, cambios de humor o conducta de sus hijos, que pudiera debelar algún abuso. “El llamado a la comunidad es a tener cuidado especialmente con nuestros hijos. ACERCAR INFORMACION La madre de la menor también instó a los padres a estar prevenidos ante conductas como distanciamiento de ciertas personas o se percibe tristes. “En nuestro caso, mi hija se enfocó en una cosa en especial para hacer, nunca me hizo sospechar de nada. A veces se enfocan en algo, como para olvidar lo que les está pasando, por eso hay que estar prevenidos y entregar confianza, porque cuando hay confianza con los niños lo debelan. Mi hija lo pudo decir a los 13 años, pero hay casos en que lo cuentan en la adultez”, señaló. En esa línea, la vecina hizo un llamado a las autoridades y servicios de la comuna de Dalcahue a trabajar en la prevención y denuncia de abusos sexuales, en especial en sectores rurales, haciendo charlas a la comunidad en general y que no solo se aborde en el colegio. “Que el municipio o corporación entregue ese apoyo de orientar a los padres, por qué hace falta eso en los sectores rurales. Ayudaría harto a muchas madres que tienen miedo o no saben qué hacer cuando sus hijos develan este tipo de abusos.  Si es que se puede, serviría mucho. Hay que enfocarse en los lugares de difícil acceso, nos pasó en un lugar donde no hay un control de nada, que lleguen a una sede social que les permita abrir los ojos a las personas, creo que falta conciencia sobre estas cosas”, apuntó,  haciendo un llamó a los padres y madres a creer a los niños cuando revelan una situación de este tipo."
3,"""Las autoridades deben sumarse a la campaña ¡No enmudecer! para visibilizar con más fuerza esta problemática""","Con el objeto de mejorar las políticas de prevención y ofrecer una mejor respuesta ante los casos que se presenten, la Municipalidad de Dalcahue al igual que otros organismos públicos y privados de la provincia, trabaja en una serie de acciones para hacer frente al flagelo del abuso sexual infantil. Es por ello que el alcalde Juan Hijerra hizo hincapié en la labor centrada en la prevención y autocuidado. La autoridad edilicia remarcó que las principales líneas de acción de sus equipos de trabajo, están relacionadas al poder motivar acciones que aborden este problema desde el diálogo constante. ¿Qué acciones concretas impulsa su municipio para enfrenar el problema del abuso sexual infantil en su comuna? -A través de la red que hay de apoyo de la mesa, en la cual están los psicólogos y asistentes sociales de las escuelas, del municipio, y del área de atención primaria, por supuesto hay toda una estrategia para estar atentos a cualquier eventualidad de abuso infantil que pueda suceder en la comuna. De forma lamentable, la provincia de Chiloé lidera varios rankings a nivel nacional respecto a denuncias de este tipo. En tal sentido ¿Dónde debería focalizarse el trabajo de las autoridades tanto comunales, provinciales, regionales y parlamentarias? -Yo soy un convencido de que los flagelos que presenta nuestra sociedad, parten del núcleo familiar. En la medida de que los distintos actores como los padres, seamos capaces de entregarle valores y fortalecer en el crecimiento a nuestros niños, en el futuro podríamos tener una sociedad mucho mejor, pero hoy día puntualmente yo creo que el tema de la prevención, y el llamado al autocuidado es fundamental. -¿Cómo evalúa lo que ha sido en estos 10 años desde su creación, la campaña ""No Enmudecer: Chiloé combate con fuerza el abuso sexual infantil"" impulsada por el Diario La Estrella? -El acierto del Diario La Estrella, que es un instrumento potente en la provincia, es poner sobre la mesa un problema que existe, pero que muchas veces no se tomaba conciencia o no se veía que era tan grave. Lo que ha hecho el Diario La Estrella es obviamente entregarlo a la luz pública, y si en estas campañas que lidera el Diario se suman los municipios, los alcaldes, los parlamentarios, y las instituciones que trabajan la problemática, esto toma mayor fuerza. Felicito a La Estrella por liderar esta cruzada provincial y visibilizar este flagelo para que todos juntos como sociedad enfrentemos con firmeza el abuso sexual infantil."
4,"Denuncias por delitos sexuales aumentan 27,7% en Chiloé","La Policía de Investigaciones (PDI) a nivel nacional entregó en los últimos días un preocupante estadístico a nivel nacional: las denuncias por delitos sexuales aumentaron un 24,7 por ciento durante el primer semestre, con relación al igual periodo del 2020. El confinamiento durante la pandemia del covid-19 se vislumbró como uno de los factores gatillantes de esta cruda realidad. El jefe de la Brigada Investigadora de Delitos Sexuales (Brisex) Metropolitana, Manuel Fuentes, señaló que ""son las personas más cercanas (los autores), entonces al estar confinado víctima y victimario, conviven en el mismo espacio físico (…) lo que podría ser una causa del aumento de las denuncias, porque han ocurrido más hechos en este contexto"". Esta dinámica golpea incluso con más fuerza a la provincia, donde estos aberrantes ataques están enquistados en la sociedad. Según los antecedentes que entrega el Centro de Estudios y Análisis del Delito (CEAD) de la Subsecretaría de Prevención del Delito del Ministerio del Interior, durante los primeros seis meses de este 2021 las notificaciones por estos ilícitos de connotación sexual se incrementaron en un 27,7%, en comparación con el año pasado. Denuncios por 30 violaciones y 76 abusos y otros ilícitos relacionados, se contabilizaron en este periodo, a diferencia de los 83 totales que el 2020 fueron informados a las policías. Con relación a casos policiales, que junto a las denuncias incluye las detenciones flagrantes, el alza en el primer semestre de esta temporada llegó a un 24,2%. En el marco de este escenario, el jefe de la Brisex de Ancud, el subprefecto Mauricio Espinoza, enfatizó que esta unidad especializada ""registró una leve alza respecto a la cantidad de denuncias realizadas en el primer semestre de este año, en comparación al mismo periodo del año 2020"". Aclaró el oficial que ""de acuerdo a las estadísticas internas de la PDI, se trata de hechos de connotación sexual ocurridos en la provincia, destacando el abuso sexual de menor de 14 años como el delito con mayor cantidad de denuncias, tanto en el 2020 como el 2021; seguido por el delito de violación de menor de 14 años, realidad que se replica con las cifras existentes a nivel nacional"". Respecto de las órdenes de investigar recibidas por la Brisex, ""estas pasaron de 158 decretos durante el primer semestre del 2020 a un total de 162 durante el mismo periodo del presente año"". Bajo este contexto, el jefe policial hizo un llamado a la comunidad a dar cuenta de estos ilícitos, ""acercándose tanto a los cuarteles de la PDI de Ancud, Castro y Quellón, como también a cualquiera de las fiscalías locales de Chiloé"". Por su parte, esta tendencia al alza igual se observa en el resto de este año en la jurisdicción más populosa de Carabineros: la Segunda Comisaría de Castro, que junto a la capital chilota incluye a las comunas de Dalcahue, Chonchi, Puqueldón, Curaco de Vélez y Quinchao. Según los datos que entrega el Sistema Táctico de Operación Policial (STOP), hasta el 29 de agosto pasado, se observó un incremento del 36% de los casos policiales por violación. Junto con explicar que esta alza se grafica en cuatro hechos más durante este periodo del 2021, con relación a igual lapso del 2020, el mayor Gustavo Guajardo, titular de la unidad base, enfatizó que ""uno de los factores que podrían explicar este aumento está dado en que se han denunciando más hechos en este tiempo, por delitos que ocurrieron en años anteriores"". ""El abuso sexual de menor de 14 años es el delito con mayor cantidad de denuncias, tanto en el 2020 como el 2021; seguido por el de violación de menor de 14 años"". Mauricio Espinoza,, jefe de la Brisex de Ancud. La Fiscalía Regional de Los Lagos también informó de alzas relativas a delitos de connotación sexual, en cuanto a salidas judiciales, que alcanzaron durante el primer semestre de este año un 49%, situando a Los Lagos como la región con el más alto porcentaje en el país con relación a sentenciadas condenatorias, suspensiones condicionales u otras formas de término de estas causas. 106 notificaciones por delitos sexuales se registraron el primer semestre de este año."
5,Balance por las fiestas: siniestros viales bajo control y la VIF concentra la judicialización de causas en Chiloé,"Los balances de seguridad por los feriados de Fiestas Patrias arrojaron dos tendencias bien marcadas. Por un lado, los casos de violencia intrafamiliar (VIF) gatillados por el consumo de alcohol concentraron la judicialización; mientras que por otro, los siniestros viales se mantuvieron bajo control ante las férreas fiscalizaciones carreteras en 17 puntos de la provincia. Reflejando que constituye una de las problemáticas sociodelictivas con mayor alcance en Chiloé, durante estas celebraciones las VIF aumentaron, sin considerar la enorme cifra negra que azota este flagelo. Los tribunales insulares recogieron más de una veintena de causas por maltratos habituales, desacato y amenazas. Y no solo se trató de agresiones a mujeres, que agrupan la mayoría de estos casos. Incluso, dos de los hechos más graves se trataron del ataque de un joven de 22 años a su hermano de 24, en Castro. El imputado fue formalizado por lesiones menos graves agravadas en contexto de VIF, como también por amenazas a su madre (de 56 años). El castreño quedó en prisión preventiva. Por su parte, en el Juzgado Mixto de Quellón, una mujer de 34 años fue encausada por lesiones menos graves en VIF, tras propinarle una estocada a su pareja, un sujeto oriundo de Río Bueno de 25 años. La encartada quedó con prohibición de acercarse a la víctima. Tal como explicó la fiscal Karyn Alegría, la imputada ""le provocó lesiones clínicamente de mediana gravedad. Por tener irreprochable conducta anterior no se decretó una cautelar más gravosa, además el propio afectado tomó la decisión de abandonar el hogar común, en consideración que la mujer tiene hijos menores de edad"". Asimismo, la persecutora describió que la gran mayoría de los delitos ""encierra el consumo problemático de alcohol"", no solamente asociados a VIF, ""sino en casi todos los imputados que pasaron en estas fiestas presentaban esta situación"". Un fenómeno que se replicó en todo el Archipiélago. En tanto, las fiscalizaciones vehiculares de Carabineros se potenciaron en la provincia, llegando a 2 mil 131, desglosadas en 657 en los sectores urbanos y 1.474 en el marco del programa ""Ruta Segura"" que se concentra en las principales carreteras insulares. El total de controles aumentó un 59,5 por ciento con respecto al 2020 y un 21,4% con relación al 2019, año en que no hubo restricciones por pandemia de covid-19. Dentro de este despliegue, ocho conductores fueron detenidos por manejo en estado de ebriedad y otro por manejar bajo la influencia del alcohol. Una cifra muy inferior a los 31 aprehendidos totales el 2020 por ambos ilícitos. Asimismo, los funcionarios policiales llevaron a cabo en estas Fiestas Patrias 703 controles de identidad, 368 alcotest a los choferes y 862 inspecciones a locales de expendio de alcohol. Las cifras fueron valoradas por el jefe de la prefectura de Carabineros de Chiloé y Palena, coronel Pedro Álvarez, quien indicó que ""el balance fue positivo en cuanto a la siniestralidad y la labor de nuestros servicios que se potenciaron el viernes 17 hasta la noche del domingo. Estos dispositivos surtieron efecto y al parecer se creó una conciencia preventiva en los usuarios de las vías"". Resaltó el oficial que la accidentabilidad fue baja en cuanto a conductores etílicos, indicando como uno de los factores que ayudó a este escenario el reforzamiento educativo en la comunidad, con campañas permanentes y puntuales por estas fechas. ""Se llevó a cabo la iniciativa #LaOtraPandemia cuyo objetivo fue crear conciencia en los conductores remarcando la incompatibilidad entre la ingesta de alcohol/drogas y la conducción. Con simulacros en varias comunas (Castro, Dalcahue y Ancud) se generó un impacto positivo, lo cual se complementó con los servicios en las carreteras, que se llamó Ruta Segura"", acotó. Igualmente, la capitana María Fernanda Aspe, titular de la Sección Investigadora de Accidentes de Tránsito (SIAT) Chiloé, mencionó que el enfoque en estas Fiestas Patrias fue educativo. ""Quisimos llevar a la ciudadanía diferentes intervenciones para incidir en la gente y crear conciencia en la conducción vial, lo cual pudimos observar en las diferentes fiscalizaciones que realizamos para entregar mayor seguridad"", explicó la uniformada. Agregó la fuente que se registraron 9 siniestros viales en la provincia, a diferencia de los cuatro del 2020: ""Una cifra que no es comparable por la menor movilidad existente el año pasado por la pandemia, pero si se compara este 2021 con el 2019 se disminuyó (la accidentabilidad) un 23% y un 27% con el 2018"". ""38 infracciones fueron por exceso de velocidad, que es la principal causa de muerte de accidentabili-dad vial"". María Fernanda Aspe,, jefa de la SIAT Chiloé. 151 infracciones de tránsito se cursaron en Chiloé y hubo 2 detenidos por manejar con licencia suspendida."
