,title,text
0,Quemchi: obrero se va preso por ultraje a su hija tras festejos de Fiestas Patrias,"Tras ampliarse por tres días la detención de un obrero en espera de diligencias policiales y peritajes, la jornada de ayer fue formalizado ante el Juzgado de Garantía de Ancud por violación impropia, en perjuicio de su hija de 13 años. Un aberrante ataque sexual infantil registrado en el sector rural de Tubildad, en la comuna de Quemchi, por el cual el sujeto quedó en prisión. Los vejámenes se habrían registrado durante Fiestas Patrias. Para pasar las celebraciones, el encartado junto a sus tres hijas se trasladó desde Hualaihué, provincia de Palena, hasta la casa de un pariente en esta localidad rural quemchina. Justamente, tras los festejos dieciocheros quedó al descubierto la agresión. Para mayor impacto y reflejando que los alcances de estos ilícitos golpean a toda la familia, habría sido una hermana de la menor quien detectó las vulneraciones, perpetradas en la misma habitación que estaban compartiendo. Tras los gritos y llanto de las niñitas, el dueño de casa se encargó de denunciar a su propio hermano ante Carabineros del Retén de Quemchi, que se constituyó con una patrulla y procedió a recabar los antecedentes de la víctima y testigos. Un dispositivo que por flagrancia llevó a la aprehensión del encartado de 53 años. En una ambulancia del centro de salud familiar (cesfam) local la estudiante fue remitida hasta el Hospital San Carlos de Ancud para constatar lesiones. Además, el fiscal Javier Calisto, instruyó la práctica de los peritajes sexológicos para recabar información científica sobre el caso. Bajo este escenario, en la audiencia de control de la detención, el persecutor solicitó ampliar en el máximo legal la aprehensión del obrero, en espera de estos resultados. ""Igual se requería antes de formalizar el informe de la Brigada Investigadora de Delitos Sexuales (Brisex), que se constituyó en el lugar y lleva a cabo las diligencias"", aclaró. Al acogerse esta prórroga por parte del magistrado (s) Nicolás Santibáñez, durante este miércoles se realizó la audiencia virtual en que el imputado fue encausado por violación de menor de 14 años. ""Solicitamos la prisión preventiva en consideración de la gravedad del delito y la pena de crimen asignada al mismo. También hay que considerar que se configura una agravante objetiva, como es el parentesco"", esgrimió el representante del Ministerio Público. La defensora Fernanda Molina se opuso a esta precautoria, argumentando que ""se cuestionaron los presupuestos materiales del delito, puesto que el informe médico, el sexológico, no arrojaba la prueba suficiente para acreditar una penetración reciente"". Igualmente, la abogada manifestó que se solicitó la ""inhabilidad del tribunal porque se presentó un recurso de amparo en la Corte de Apelaciones (ver recuadro)"" de Puerto Montt. Pese a estas alegaciones, el sentenciador acogió la cautelar más gravosa contra el encartado, por lo cual se mantuvo en el Centro de Detención Preventiva (CDP) de Ancud. En tanto, se ofició al Juzgado de Familia de la comuna del Pudeto la situación de indefensión en que quedaron las tres hermanas. La jueza Macarena Muñoz determinó entregar bajo acta a las menores -estaban al cuidado de su padre- a su madre. El defensor penal Filippo Corvalán interpuso un recurso de amparo contra la resolución del magistrado (s) de Ancud, Nicolás Santibáñez, de declarar legal la detención de este imputado por violación impropia. Acusó que esta actuación estaba viciada, ""al haber transcurrido los plazos prescritos por el ordenamiento jurídico"", consistentes en 24 horas como máximo entre la aprehensión flagrante y la puesta a disposición de la justicia del encartado. El sábado a las 8.30 fue detenido el obrero por Carabineros y a las 8.58 del domingo fue controlado ante el Juzgado de Garantía de Ancud. La segunda sala de la Corte de Apelaciones de Puerto Montt resolvió el martes recién pasado que ""no se desprenden ilegalidades"" en la detención, por lo cual rechazó el requerimiento del defensor que buscaba dejar en libertad al encartado. 16 años tiene la niña que descubrió el ataque. La tercera hermana tiene apenas 10 años. 90 días se decretaron para llevar a cabo las diligencias por esta causa."
1,"Después de 5 semanas en fase 2, Puerto Montt vuelve a cuarentena","A un mes y siete días de haber avanzado a fase 2 (Transición) en el plan Paso a paso, la comuna de Puerto Montt nuevamente volverá a cuarentena a contar de las cinco de la mañana de este jueves 14. La decisión fue comunicada ayer por la subsecretaria de Prevención del Delito, Katherine Martorell, durante un punto de prensa realizado en La Moneda, ocasión en la que detalló que también retroceden a confinamiento total las comunas de Puerto Varas y Calbuco, en la Provincia de Llanquihue; así como Castro, Ancud, Dalcahue y Quellón, en la de Chiloé; además de Osorno, en la provincia del mismo nombre. Asimismo, desde la misma fecha la comuna de Hualaihué, en la Provincia de Palena, deja de estar en fase 4 (Apertura inicial) y queda en la etapa 2. Al analizar el escenario regional, el doctor José Antonio Vergara, epidemiólogo de la Seremi de Salud, partió reconociendo que ""estamos en una situación muy crítica"". Definió que el criterio principal que se ha empleado en esta oportunidad es la incidencia de nuevos casos. ""Hay comunas que están teniendo tasas de incidencia muy altas, que se traduce, por ejemplo, en la mantención de casos activos en un volumen muy importante, que a su vez son fuente de nuevos casos"", dijo. Según el informe de la Seremi de Salud, Puerto Montt reportó ayer 188 nuevos casos, para acumular 10.496 desde el comienzo de la pandemia. En cuanto a sus casos activos, totaliza 919, de los 1.516 de la Provincia de Llanquihue. Vergara añadió que el número reproductivo efectivo regional es de 1,29 ""superior incluso al de la Región Metropolitana"", por lo que argumentó que la medida de cuarentena total ""se hizo imprescindible en el escenario actual"". Ante una consulta, el epidemiólogo sostuvo que la situación de las comunas que retroceden a cuarentena ""es homologable"" al estado regional, ""con un incremento importante en la incidencia de casos y en la tasa de prevalencia de casos activos, que se transforman en una fuente potencial de nuevos casos"". El doctor Vergara argumentó que el ascenso de la frecuencia de aparición de casos nuevos ""tiene que ver con las comunas que son más populosas, en función de las masas de población entre las que el virus tiende a circular. La conurbación que existe entre Puerto Montt y Puerto Varas es un ejemplo del intenso intercambio de personas durante todo el día, entre ambas comunas "", apuntó. El secretario regional ministerial (seremi) de Salud, Alejandro Caroca, aseveró que ""cada uno de nosotros ha fallado"" en cuanto a mantener las medidas preventivas de contagio, como el uso adecuado de la mascarilla, mantener el distanciamiento social y el frecuente lavado de manos. ""El comportamiento de la población no ha estado a la altura"", añadió, lo que ha implicado -sostuvo- tener que implementar medidas de restricción del movimiento y libertades. Sobre la implementación de esta segunda cuarentena, el seremi Caroca resaltó que a diferencia de la primera, que se extendió por 4 meses y 6 días, el nuevo plan Paso a paso anunciado ayer por el gobierno, definió que estos confinamientos no se extenderán más allá de cuatro semanas. Caroca comentó que podría levantarse esta restricción, lo que depende la tendencia que muestren los contagios y las cifras. ""Lo peor que nos podría ocurrir como comunidad es que al cabo de un mes sigamos igual o peor (...). Sería fantástico a lo mejor estar en dos semanas más anunciando que lo hemos hecho tan increíble, cada individuo de nuestra comunidad, que podamos retrotraernos a una situación mejor"", aventuró. Cuando se le preguntó si las cuatro semanas definidas es el límite definitivo, aunque no haya variación favorable de los indicadores sanitarios, enfatizó que ""la idea de las medida de cuarentena acotada es cortarla a contar de la cuarta semana"", aunque se podría prolongar si es que se evidencia ""una situación más dramática aún; es decir, en extremo complejo que esperemos que -obviamente- no lleguemos"". Anticipó que habrá fiscalizaciones internas en cada ciudad y que implementarán cuadrillas especiales junto a las Fuerzas Armadas y Carabineros ""que van a ir de manera aleatoria buscando centros (de aglomeración de personas), con la finalidad de ir disminuyendo la movilidad"". Advirtió que serán inflexibles en cuanto a la verificación de los requisitos de desplazamiento, lo que implicará sumarios sanitarios y sanciones, en lo que no descartó proceder a la respectiva detención. En cuanto a las actividades permitidas en cuarentena, el seremi de Salud especificó que sólo estarán autorizadas las de rubros esenciales, con el debido permiso único colectivo. ""Independiente que las personas cumplan con la normativa vigente (permiso colectivo), vamos a realizar investigaciones para certificar la veracidad"", por lo que recomendó incentivar el teletrabajo. Los actuales indicadores han provocado una fuerte tensión de la red asistencial, lo que se ha visto reflejado en que ayer sólo había 3 camas UCI disponibles en toda la región, así como 14 ventiladores mecánicos para ser utilizados. El doctor Jorge Tagle, director del Servicio de Salud del Reloncaví, sostuvo que las unidades vacantes corresponden a la Clínica Alemana de Osorno y a los hospitales de Castro y de Puerto Montt. El coordinador regional de ""La conurbación que existe entre Puerto Montt y Puerto Varas es un ejemplo del intenso intercambio de personas durante todo el día"" José Antonio Vergara,, epidemiólogo de la Seremi de Salud. ""Lo peor que nos podría ocurrir como comunidad es que al cabo de un mes sigamos igual o peor"" Alejandro Caroca,, seremi de Salud. la red asistencial subrayó que ""estamos viviendo la situación más compleja en toda la pandemia"". Tal preocupación se extiende a los 228 enfermos covid que están hospitalizados en la región, de los cuales 117 están en el HPM, donde hasta las 11 horas de ayer, había 25 contagiados en la UCI, 21 de ellos conectados a ventilación mecánica invasiva. La directora de ese centro asistencial, Mónica Winkler, reconoció que hubo 11 ingresos de pacientes covid en las últimas 24 horas y que 50 de esos pacientes ocupan camas críticas, de las que existen 37 camas UCI adulto y 61 UTI. Ante este panorama, admitió que están tomando medidas ""para seguir avanzando en la complejización de camas durante esta semana y así sumar tanto cupos UCI como cupos UTI en los próximos días"". A ello sumó que resolvieron suspender las cirugías electivas, ""excepto las de tiempo sensible como el cáncer""; y que difieren prestaciones ambulatorias que no sean de primera necesidad, salvo el Policlínico de Tratamiento Anticoagulante, el Policlínico de Unacess o enfermedades de transmisión sexual, los controles pos-alta y pos-quirúrgicos, entre otros. Respecto del retroceso a cuarentena, el alcalde de Puerto Varas, Ramón Bahamonde, reaccionó con molestia, especialmente porque no fue informado de la medida. ""Que el señor ministro (Enrique Paris) no le exija a la gente que cumpla medidas restrictivas, cuando ellos no tienen la capacidad ni siquiera de comunicación para tomar medidas (...). Si la gente está violando todas las disposiciones, es porque no han sabido y no tienen los cojones ni la capacidad de tomar soluciones adecuadas"", manifestó. El jefe edilicio reclamó que no hay diálogo ni conocimiento de la realidad de Puerto Varas. ""Lo siento por nuestra gente por quienes crearon una inversión turística y que es tirada por el suelo al minuto. No se puede jugar con la gente"", manifestó. Bahamonde recordó que hace 15 días la subsecretaria de Salud, Paula Daza, analizó con él medidas a implementar ""para que Puerto Varas se incorpore a las políticas de desarrollo del turismo y sea un punto vacacional"". Consideró el anuncio de retroceso a cuarentena ""como un portazo, sin tener la decencia de comunicarse con las autoridades locales y poco respeto al comercio establecido"", ante lo que pidió que ""no nos invadan con violaciones a las disposiciones vigentes, porque la gente ya les perdió la confianza y el respeto a cualquier decisión que puedan tomar, si no hay una comunicación que llegue a la fuente oficial que debe comunicarse con las personas"". 38 días o 5 semanas y 3 días en la fase 2 (Transición) alcanzará a estar Puerto Montt este jueves, cuando comience su segunda cuarentena por covid. 18 semanas y 5 días fue la primera cuarentena en Puerto Montt (29 de julio al 7 de diciembre). Este nuevo confinamiento no debería sumar más de 4 semanas."
2,Cambian medida cautelar de hombre investigado por VIF en Hualaihué: habría amenazado a víctimas,"La información es de biobiochile.cl y señala que, un hombre investigado por al menos cuatro hechos de violencia intrafamiliar contra la misma cantidad de víctimas, fue enviado desde Hualaihué a cumplir prisión preventiva en Puerto Montt, región de Los Lagos. Se trata de Jorge Barrientos, quien permanecía con firma quincenal y prohibición de acercarse a las víctimas, por ser sujeto de investigación en hechos que afectaron a mujeres que fueron sus parejas, de las cuales una se suicidio. Esta última persona es Deisy Compay, joven de Cochamó que estando embarazada, habría sido agredida por el imputado a quien denunció para luego retractarse, volviendo a casa con el mismo, lugar donde fue encontrada fallecida y sin lesiones atribuibles a terceros. Hay otras tres víctimas que posterior al fatal desenlace dieron cuenta de agresiones del mismo hombre, y de éstas, dos habrían sido contactadas por redes sociales en el último tiempo por el imputado, como cuenta el abogado querellante del Sernameg, que representa a una de ellas, Thomas Patri. “Estas nuevas amenazas nos dieron la posibilidad de establecer al tribunal el hecho de que varían las circunstancias y que la medida cautelar de firma quincenal ya no va en protección de las víctimas, sino que se necesita otra medida más gravosa”, explicó.Como afirmó Patri, las medidas cautelares con el paso del tiempo fueron perdiendo efectividad y ya que las denuncias se arrastran hace casi un año, la dilatación del proceso habría generado también que se pase por sobre la prohibición de acercarse a las víctimas o tomar contacto con ellas. El abogado del Servicio Nacional de la Mujer y Equidad de Género, mencionó que parte de los delitos por los cuales se investiga al hombre son lesiones menos graves, maltrato habitual, violación de mayor de 14 años y desacato. En la causa que se indaga la muerte de Deisy Compay, queda pendiente un juicio simplificado, el que debía realizarse en septiembre del año pasado, algo que no ocurrió por motivos que se desconocen a la fecha. Las demás investigaciones siguen su curso, con las víctimas siendo acompañadas por los querellantes e instituciones, según se ha dicho, y con el imputado, luego de este veredicto, tras las rejas. Fuente: Biobiochile.cl"
3,Investigan denuncias de abusos sexuales que habrían ocurrido en Cesfam de Hualaihué," Son varias mujeres las que denunciaron en la fiscalía de Hualaihué delitos de connotación sexual que habrían ocurrido en el Centro de Salud Familiar de Río Negro, hechos que son materia de investigación por la Brigada de Delitos Sexuales de la PDI. La orden de investigar fue realizada por el fiscal Gonzalo Meneses “por hechos posiblemente constitutivos de delitos” ya que de acuerdo a lo informado por el persecutor existen varias denuncias recibidas durante las últimas semanas en la Fiscalía.  Las denuncias también fueron realizadas al Servicio de Salud del Reloncaví. En ese marco, los hechos que se denuncian, y que se han hecho públicos a través de distintos medios, generaron el pronunciamiento del Colegio Médico de Puerto Montt. El Colegio Médico de Puerto Montt expresó a través de una declaración pública el apoyo a funcionarios y usuarios víctimas de los presuntos abusos, y condenaron los hechos. Pese a las gestiones de radio Sago, el Dr. Jorge Tagle, Director del Servicio de Salud Reloncaví no ha entregado declaraciones en torno a este caso."
4,Usuarias y funcionarias de cesfam denunciaron ser víctimas de violencia sexual por parte de profesional del recinto,"A través de un declaración pública, el Colegio Médico de Puerto Montt,  junto al Capítulo Reloncaví de la Agrupación de Médicos Generales de Zona y el Equipo Médico de la Comuna de Hualaihué, expresaron su preocupación ante los diversos casos de violencia sexual denunciados en el Cesfam Río Negro Hornopirén. Según consignó SoyChile, se trataría tanto de funcionarias como pacientes, quienes han sido afectadas por las acciones de un profesional del recinto, durante sus atenciones clínicas. Los casos han sido denunciados a través de la Oficina de Informaciones Reclamos y Sugerencias (OIRS) del Ministerio de Salud, acciones judiciales y redes sociales. ""Considerando la situación actual que vive el país, donde la violencia de género, machista y patriarcal debe ser expuesta, denunciada y bajo ninguna circunstancia tolerada, es que expresamos nuestra preocupación por los lamentables sucesos denunciados y manifestamos nuestro apoyo a las víctimas, condenando todos los hechos de violencia que pudieran haber ocurrido"", señaló el escrito, asegurando que es un derecho primordial el proteger a las personas, ""La atención clínica debe siempre llevarse a cabo respetando la dignidad y completa autonomía de las usuarias, bajo estrictos estándares éticos y morales"", expresaron, haciendo un llamado a las autoridades para agilizarlas investigaciones, lo que permitirá determinar eventuales responsabilidades. ""Solicitamos que se tomen las medidas de resguardo pertinentes, para la debida protección de las víctimas usuarias de nuestro sistema de salud, evitando a toda costa la revictimización de las afectadas"", concluyó el mensaje. "
5,Investigan en Hualaihue denuncias de abusos sexuales que habrían ocurrido en CESFAM,"Son varias mujeres las que denunciaron en la fiscalía de Hualaihué delitos de connotación sexual que habrían ocurrido en el Centro de Salud Familiar de Río Negro, hechos que son materia de investigación por la Policía de Investigaciones a través de la Brigada de Delitos Sexuales.La orden de investigar fue realizada por el fiscal Gonzalo Meneses “por hechos posiblemente constitutivos de delitos” dado que existen varias denuncias recibidas durante las últimas semanas en la Fiscalía. Las denuncias también fueron realizadas al Servicio de Salud del Reloncaví a través de la oficina de Reclamos y por redes sociales generando preocupación en la comunidad. Los hechos que se denuncian, y que se han hecho públicos a través de distintos medios, generaron el pronunciamiento del Colegio Médico de Puerto Montt y del Servicio de Salud del Reloncaví.El Colegio Médico de Puerto Montt expresó en una declaración pública el apoyo a funcionarios y usuarios víctimas de los presuntos abusos, y condenaron los hechos pudiesen haber ocurrido. Por su parte el Servicio de Salud del Reloncaví manifestó que se estaría realizando una investigación interna, sumario administrativo, por las denuncias que ha recibido el Servicio."
