,title,text
7,Indagan otra denuncia de connotación sexual en hogar de menores de Ancud,"Una nueva denuncia aqueja a la Residencia Santa Mónica en la comuna de Ancud, a partir del testimonio de niñas que se acogen en este hogar, debido a presuntos actos de carácter sexual que habrían ocurrido al interior del establecimiento dependiente del Servicio Nacional de Menores, Sename, y en los cuales estarían involucrados cuidadores de trato directo. Los hechos se remontan al mes de enero de este año y se están investigando por la justicia dado que se trataría de situaciones que eventualmente constituirían delitos, ya que al menos dos educadores habrían sido protagonistas de actos sexuales en el mismo recinto, a vista de los menores que allí viven, de acuerdo al relato de los mismos usuarios. El año pasado, la misma institución se vio involucrada en acusaciones de maltrato y abuso hacia residentes, por parte de educadores, lo que generó protestas de la comunidad y que podrían replicarse tras este otro incidente. Yolanda Cárdenas, activista y observadora de derechos humanos de la ONG Fuerza y Unión, actualmente se encuentra formalizando una fundación para la protección de la infancia y según explicó, la situación denunciada en enero se generó por la indagatoria que emana desde el 2020, debido a que los mismos menores habrían relatado los otros hechos. ""Hoy en día quedaron al descubierto tres casos más con testigos oculares que son menores de edad. Como ya los estaban investigando por eso (abuso sexual), entonces les empezaron a tomar las declaraciones al resto de niños y los que vieron estos abusos son los que generaron la denuncia"", comentó la fuente. Los cuidadores que habrían cometido los actos notificados fueron desvinculados de la residencia, de acuerdo a lo que sostuvo la directora regional del Sename, Lilian Peña y, asimismo, se denunció el hecho a la Fiscalía y al Juzgado de Familia de Ancud, para que sean investogados. ""A partir de una develación que hizo alguna de las niñas de la residencia, presentamos la denuncia a tribunales de Familia, a la Fiscalía e internamente iniciamos las investigaciones y acciones correspondientes para determinar la veracidad de los hechos, situaciones que hoy día se están indagando desde el punto de vista administrativo y penal"", explicó la personera. Remarcó la profesional que ""en el momento en que fueron conocidos los hechos por parte de nosotros, en menos de dos horas, habíamos desvinculado a los funcionarios del proyecto"". Igualmente, la funcionaria pública acotó que una vez que se conozcan más antecedentes de la causa, no se descartan otras acciones con el fin de proteger a los residentes del hogar. ""Hemos actuado responsablemente de acuerdo a los mandatos que nosotros tenemos y por supuesto que no descartamos otras acciones que pudiéramos tomar en la medida de que vamos avanzando en los procesos de investigación que van en curso"", señaló la asistente social. Independiente del proceso judicial en curso, los hechos mantienen preocupada a la ONG Fuerza y Unión, por lo cual no descartan nuevas movilizaciones con el fin de visibilizar la situación que ocurre en el establecimiento. ""Vamos a tener una marcha en unos 15 días más, donde nos juntaremos varios dirigentes de varias ciudades, ya estamos redactando cartas, porque queremos llegar a La Moneda, entregar personalmente esas cartas, porque acá en Ancud se están vulnerando los derechos de los niños, acá no se hace nada porque no hay reclamantes para esos niños"", Especificó cárdenas. A su vez, la vocera sostuvo que todo lo que se vive con estos menores ""es una cadena, el abogado que los defiende es sustentado por el Estado, los organismos colaboradores, sustentados por el Estado, y en este momento a los niños el Estado los deja vulnerables, porque ni siquiera el político se hace cargo de la niñez"". Junto con detallar que se encuentra formando una fundación llamada ""La Voz de Nuestros Locos Bajitos"", la actividad consignó que se investigará a fondo la situación de la Residencia Santa Mónica, pues esperan entregar apoyo judicial, terapéutico y emocional a los usuarios del establecimiento. ""Vamos a tener una marcha en unos 15 días más, donde nos juntaremos varios dirigentes de varias ciudades"". Yolanda Cárdenas."
8,Criminal arriesga severa pena por ultrajar a su conviviente en Chonchi,"Ante el peso del valiente testimonio de la víctima, durante la jornada de ayer se acreditó la responsabilidad de un sujeto en el delito de violación, perpetrado contra quien era su conviviente en Chonchi. Un ataque sexual por el que invocan una pena de 7 años de cárcel contra el delincuente. En audiencia que se extendió dos jornadas en el Tribunal Oral en lo Penal de Castro, la sala presidida por la magistrada Loreto Yáñez conoció los antecedentes acusatorios contra el imputado de iniciales C. O. M. M. (41), quien nuevamente enfrentó a la justicia, puesto que ya había sido condenado -por el sistema penal antiguo- a 18 años de presidio por un robo con homicidio. Los hechos en este caso ocurrieron el 30 de julio del 2019, apenas 21 días después que comenzara la relación entre los intervinientes. Esa jornada, los sentenciadores ratificaron que el acusado atacó a la mujer de 43 años, quien sufrió una serie de lesiones. Tras escapar de la casa pidió ayuda a un vecino que la trasladó en camioneta hasta el cuartel de Carabineros donde estampó la denuncia. Como especificó el fiscal Enrique Canales, quien sustanció las diligencias, esta dinámica fue confirmada por los jueces, lo cual desvirtuó la presunción de inocencia que amparaba al encartado. ""Se entregó el veredicto condenatorio por un delito de violación con el uso de la fuerza que padeció una mujer en un sector rural. En el juicio se rindió toda la prueba, siendo fundamental la detallada declaración que prestó la víctima sobreponiéndose de lo que significó para ella enfrentar un tribunal, siendo valiente pero contando su dramática experiencia"", dijo el abogado. A su vez, el persecutor valoró la evidencia que derivó del trabajo de la Brigada Investigadora de Delitos Sexuales (Brisex) de Ancud y los peritos del Servicio Médico Legal (SML). ""No menor fue el aporte de testigos, personas que incluso no tenían relación con la víctima pero colaboraron con la justicia penal y permitieron la reivindicación de esta víctima"", añadió. Por su parte, el defensor Juan Manuel Castro, quien había solicitado preliminarmente la absolución ""por insuficiencia probatoria"", como indicó, está pidiendo 5 años y un día de presidio, ""con el concurso de la atenuante de colaboración sustancial, en base a la declaración que prestó mi representado en el juicio"". La lectura de sentencia quedó fijada para este domingo en la misma sala."
9,"Comisión dio libertad a 5,5% de reclusos que postularon","En una jornada que se extendió por más de 9 horas, la comisión de libertad condicional otorgó este beneficio sólo al 5,5% de los internos que elevaron esta solicitud a las autoridades del Poder Judicial, y cuya jurisdicción corresponde a la Corte de Apelaciones de Puerto Montt. De 217 reclusos que realizaron esta petición en los penales de Castro, Ancud y Puerto Montt, sólo fueron favorecidos 12, rechazando la comisión a la mayoría. La Comisión estuvo presidida por el ministro de la Corte de Apelaciones Patricio Rondini e integrada por los jueces del Juzgado de Garantía Marcela Araya y Juan Carlos Orellana, y los magistrados del Tribunal de Juicio Oral en lo Penal, Francisco Javier del Campo y Jaime Rojas. A su vez, participaron como relatoras María José Rojas y Alejandra Osman, como digitadora Catalina Martin Huala y como secretaria Carolina Mancilla. El seremi de Justicia y Derechos Humanos, Alex Meeder, explicó que los internos deben cumplir varios requisitos para poder acceder a este beneficio que se entrega dos veces en el año. Indicó Meeder que se tiene que tener cumplida la mitad de la pena, pero en otros delitos calificados como el homicidio, de connotación sexual y tráfico de estupefacientes se debe tener cumplido dos tercios de la condena impuesta. ""La comisión revisa un segundo requisito que las personas deben tener, entre ello, contar con cuatro bimestres de buena conducta, además Gendarmería acompaña un informe que da cuenta de los avances en cuanto a tratar de cambiar y mejorar la conducta de los internos"". El seremi comentó que la comisión de Puerto Montt es estricta, porque ""el año pasado postularon aproximadamente 160 internos y sólo se autorizaron 12 para obtener este beneficio"". Dijo la autoridad que para este 2021 se hicieron varias modificaciones en el seguimiento y en las condiciones de los internos que obtengan este beneficio, ""y hoy en día las personas que logren la libertad condicional estarán sujetas a un delegado de Gendarmería que le podrá dar continuidad a toda la intervención psicosocial recibida, por ejemplo, en materia educacional"". El presidente de la comisión, ministro Patricio Rondini, explicó que de los internos beneficiados cinco son de Puerto Montt. Detalló Rondini que sólo 12 de los internos obtuvieron su libertad condicional ""por estimar la comisión que reunían todos y cada uno de los requisitos legales, tanto desde el punto de vista del tiempo de cumplimiento de condena como asimismo su comportamiento en el interior de los centros penitenciarios y contar con un informe favorable"". Señaló el ministro del tribunal de alzada que de estos 12 casos beneficiados con la libertad condicional ""dos corresponden a Ancud, cinco a Castro y cinco a Puerto Montt"". El ministro Rondini resaltó que para este primer semestre la comisión da por concluida su labor ""y se volverá a reunir en el segundo semestre, en octubre próximo"". 12 internos fueron favorecidos en octubre del año pasado, pero el total de postulantes era de 160."
10,"""Lo más importante será contar con una residencia para las madres adolescentes""","La creación de la primera residencia para madres adolescentes embarazadas es uno de los logros que se podrá concretar, una vez se terminen de realizar los cambios en la nueva forma de operar que tendrá el Sename, desde octubre próximo, en la región y el país. Luego que el pasado 22 de diciembre de 2020, el gobierno promulgara la ley 21 mil 302, que crea el nuevo Servicio Nacional de Protección Especializada a la Niñez y Adolescencia, el cual debe entrar en funcionamiento a contar del 1 de octubre de 2021, se inició un anhelado proceso para poner fin al Servicio Nacional de Menores, más conocido como Sename, el que hasta ahora y desde 1978 se había hecho cargo, casi de manera exclusiva, de la niñez y adolescencia vulnerada en el país. Si bien la implementación del nuevo servicio ""Mejor Niñez"", como lo bautizó el gobierno, está en manos del Ministerio de Desarrollo Social y Familia, a través de la Subsecretaría de la Niñez, la preparación del traspaso a la nueva institucionalidad, ha estado en manos de los propios funcionarios de Sename y sus directivos. En la Región de Los Lagos, el Servicio Nacional de Menores atendió anualmente un promedio de entre 10 y 11 mil niñas, niños y adolescentes vulnerados en sus derechos, alcanzando los 10 mil 98 en 2020. En diálogo con El Llanquihue, la directora regional de Sename, Lilian Peña, dio a conocer cómo se ha venido preparando el servicio y sus funcionarios, para hacer frente a este proceso de traspaso de la red de protección a la nueva institucionalidad y el definitivo cierre del Sename. -¿Cómo ve usted el estado actual de Sename en la región y el proceso de instalación de una nueva institucionalidad que lo reemplaza? -Es una etapa cargada de muchas cosas, emociones, valoraciones, juicios, pero sobre todo desafíos. El Sename, por décadas, cargó con la responsabilidad de ser el servicio que debió enfrentar la protección, contención y reparación de las vulneraciones de derecho, en muchos casos dramáticas, que sufrieron niñas, niños y adolescentes en el país y en nuestra región. Sin embargo, todos sabemos, incluso los mismos funcionarios y funcionarias,¡ que por décadas entregaron su vida a este servicio, que era necesario avanzar y mejorar la forma en que el Estado venia enfrentando esta responsabilidad. Hoy estamos frente al último tramo de un camino que todos sabíamos que era no sólo necesario, sino que imprescindible. Las niñas, niños y adolescentes merecen una nueva mirada en la protección de sus derechos y una nueva forma de abordar, enfrentar y dar respuesta en todas sus dimensiones, a las vulneraciones de derechos a las que puedan ser expuestos. Este proceso no se puede tratar de lo que el Sename ha sido o debió ser, sino del compromiso que como sociedad y Estado asumiremos de aquí en adelante y en esa preparación hemos estado trabajando desde hace ya tres años. -¿Cómo ha sido ese trabajo en la Región de Los Lagos y en qué ha consistido? -No ha sido fácil, pero tampoco lo vimos inalcanzable. Creo que ha habido dos grandes miradas en materia de diseño e implementación de este proceso de preparación, para aportar desde Sename a la transformación de la política e institucionalidad de infancia en nuestro país. La primera es una mirada de Sename nacional, desde donde se generaron planes con visión país, y otra regional, en donde nuestra tarea fue aterrizar en acciones concretas los cambios necesarios para mejorar desde las metodologías de trabajo con niñas y niños, hasta la infraestructura de los centros donde acogemos a aquellos que han vivido situaciones más dolorosas. En este sentido, en lo regional, buscamos imprimir algunos principios de gestión, que tenían que ver con comprometer, involucrar, innovar para mejorar. Y en eso, que ha sido una tarea constante para lo que viene, se comprometieron primero todos los funcionarios y funcionarias, luego otras instituciones, como Injuv, Salud, Cultura, Junaeb, Sence, deportes, la SEC, el Gobierno Regional, la Universidad San Sebastián, el mundo privado. Incluso la prensa ha hecho su aporte. Es casi imposible recordar y mencionar a todos los que han querido apoyar este proceso. -¿Cómo se traduce esto, en concreto, en mejoras para lo que deberá asumir el nuevo servicio de protección? -Desde nuestra parte, hemos venido por ejemplo abriendo procesos de licitación para las residencias, con nuevas exigencias y requisitos, tanto en materia de infraestructura como de equipos profesionales para el trabajo con niñas, niños y adolescentes bajo protección del Estado. Hoy contamos con 15 residencias activas y otras en proceso de licitación, las que se han ido y seguirán especializando según género, edad y requerimientos, según grado de vulneración. Ya contamos con dos nuevas residencias en la Provincia de Chiloé, una de niñas, en Ancud, y otra en Castro para niños, ambas bajo administración de nuevos organismos colaboradores que se incorporan a esta región, en esta línea. Además, se han disminuido los cupos en cada residencia para acercarlo más a una residencia familiar. Tampoco hay que olvidar que entre 2018 y 2021 se duplicó el monto de la subvención por niño o niña, permitiendo una mayor inversión del Estado en la atención de sus vulneraciones. En este mismo ámbito, se están licitando nuevas residencias de gran necesidad en la región. Lo más importante será contar con una residencia para madres adolescentes, en donde las niñas puedan ser acompañadas, contenidas y protegidas tanto en su periodo de embarazo, como en sus primeros años de crianza de sus bebés, ayudándoles a enfrentar los desafíos propios del ser adolescentes, madre y cumplir sus expectativas de desarrollo personal. En este mismo sentido, estamos con otros procesos de licitación que nos permitirán consolidar la oferta de cuidado alternativo en la región, con mayor especialización y mejores estándares de atención. En ese mismo sentido, estamos licitando una residencia para niños en Puerto Montt, con una capacidad de 20 cupos. Es importante señalar que varios de estos procesos licitatorios vienen a reemplazar y reponer residencias que debieron ser cerradas en su momento, ya sea por mala administración o situaciones que pudieran considerarse de vulneraciones de derecho o malas prácticas. De igual forma, hemos iniciado, adjudicado y tenemos en curso procesos de licitación para los programas ambulatorios, a donde llegan niñas, niños y adolescentes que quizá no requieran un cuidado familiar alternativo, pero si requieren contención reparación y acompañamiento. Un área que es mucho más amplia dentro de lo que se conoce como ""Red Sename"", pero que, sin duda, es fundamental para evitar la institucionalización de estos niños y niñas. También hemos licitado los proyectos de intervención especializada, en donde se encuentran desde el programa especializado en explotación sexual, hasta proyectos de menor complejidad destinados a atender situaciones de vulneraciones menos graves. Donde aún tenemos como país y región una tarea pendiente en materia de mayor prevención, conciencia y compromiso ciudadano. Así, en toda el área de protección, también en el área de justicia juvenil, pero particularmente en la primera, hemos venido trabajando para hacer un traspaso metodológico y técnicamente actualizado, normado y renovado. Siempre apuntando a facilitar este proceso histórico para la política de niñez y adolescencia en nuestro país. -¿Cómo se preparan los funcionarios y funcionarias de Sename regional para este proceso y el término de la institución? -Como lo dije al principio, este ha sido un esfuerzo compartido, con la claridad de que es necesario y urgente cambiar la forma en que el Estado ha venido abordando el trabajo con las niñas, niños y adolescentes vulnerados en nuestro país. En eso estamos todos comprometidos, también las y los funcionarios de Sename. Desde el inicio de la gestión, sabiendo que este proceso llegaría, en la región hemos reforzado las alianzas con instituciones públicas y privadas, en particular con la academia, firmando convenios y ejecutando programas de capacitación y fortalecimiento de competencias de nuestros profesionales. En ese sentido, por ejemplo, hemos desarrollado proyectos de capacitación a los profesionales de la Red Sename que incluye a los organismos colaboradores, para incorporar innovación metodológica en la intervención con niñez y adolescencia vulnerada. Lo mismo se ha hecho con la Seremi de Cultura y otras instituciones, como la Universidad San Sebastián, fundación Carnaval del Sur y el Injuv, quienes nos han ayudado a incorporar nuevas metodologías y competencias en la gestión. Hoy estamos, además, en camino de nuevas iniciativas, incluso un diplomado que involucraría al INDH en el reforzamiento y generación de conocimiento aplicable en materia de intervención y protección de niñas y niños bajo protección del Estado. Las y los funcionarios están dispuestos e interesados en participar de los procesos de evaluación que vendrán, para sumarse a esta nueva institucionalidad. Hemos conversado permanentemente a través de sus representantes en la región, ha sido una constante reunirnos y conversar y espero que este sea un transito hacia la conformación de una mejor institucionalidad, pero, por sobre todo, una mejor realidad para las niñas y niños vulnerados en la región y el país. -¿Cómo avizora la constitución y el futuro del nuevo servicio ""Mejor Niñez""? -En lo personal y por el tremendo desafío que se viene por delante, les deseo lo mejor, en estos años de gestión, la coordinación y diálogo con la seremi de Desarrollo Social y Familia, Soraya Said, así como con el seremi de Justicia y Derechos Humanos, Alex Meeder, ha sido siempre de apoyo y coordinación en materias y casos regionales. Ahora nos toca pasar la posta y espero ganemos todos como país, esta tremenda maratón por las y los niños de Chile. ""Hemos venido, por ejemplo, abriendo procesos de licitación para las residencias, con nuevas exigencias y requisitos"" ""Estamos licitando una residencia para niños en Puerto Montt, con una capacidad de 20 cupos"" ""Las y los funcionarios están dispuestos e interesados en participar de los procesos de evaluación que vendrán, para sumarse a esta nueva institucionalidad"" 10.018 atenciones realizó el Servicio Nacional de Menores (Sename) durante el año 2020 en la región. 20 cupos tendrá la nueva residencia que se busca levantar en Puerto Montt próximamente. 1 de octubre de este año comienza a funcionar el nuevo Servicio Nacional de Protección Especializada a La Niñez y Adolescencia."
11,Acreditan ultrajes contra niña de 11 años en Ancud,"A una pena de 5 años de presidio se expone un sujeto tras acreditarse su responsabilidad en los ataques sexuales contra una menor en Ancud. La víctima desde que tenía apenas 11 años sufrió los ultrajes. Su valiente testimonio fue clave para configurar el delito y la participación del acusado. En un juicio vía remota que se realizó con el Tribunal Oral en lo Penal de Castro, el cual se extendió por tres jornadas, la sala presidida por la magistrada Angélica Monsalve condenó ayer al capitalino de 58 años, de iniciales G. C. E., por el delito de abuso sexual impropio en carácter de continuado. Los sentenciadores ratificaron que la prueba presentada en la audiencia desvirtuó la presunción de inocencia que amparaba al sujeto, quien incluso declaró negando por completo los hechos que se extendieron entre el 2016 y 2017. Justamente, a fines de ese segundo año, la menor que cursaba sexto básico develó su pesadilla en su colegio. De inmediato, el plantel educativo le prestó contención, denunciando y derivando a su estudiante para la intervención respectiva. Así lo destacó el fiscal de la causa, Javier Calisto, añadiendo que profesionales del centro de enseñanza como alumnos igual intervinieron en el juicio, como prueba complementaria que sustentó los cargos. ""Se presentaron testigos que contextualizaron el tema de la denuncia, los daños, como parientes que describieron la cercanía que tenía el imputado -amigo de la familia- con la niña, lo cual aprovechaba para cometer el delito"", aseveró el persecutor, relevando la declaración de la afectada en audiencia. Igualmente, el abogado enfatizó que acusó por abuso sexual reiterado, lo cual no fue acogido (se deben incorporar fechas o períodos exactos de los episodios de violencia), aunque remarcó que ""sí se acreditaron las agresiones sufridas al interior de la casa como otra fuera de ella (en un vehículo)"". El representante del Ministerio Público había invocado inicialmente 7 años de presidio, pero al ser calificado el ilícito como continuado, rebajó su pretensión punitiva a los 5 años de reclusión. Por su parte, el defensor Filippo Corvalán sostuvo en el juicio que la prueba era insuficiente para acreditar la autoría en el delito de su representado. ""Habían contradicciones, antecedentes que hacían sospechar de una eventual manipulación (de las acusaciones)"", consignó. Bajo este escenario, el profesional reconoció que la resolución de los sentenciadores ""no nos deja conformes"", salvo por el rechazo de la reiteración de los hechos. 541 días de presidio, con el beneficio de la libertad vigilada intensiva, pidió el jurista, en base a la atenuante de irreprochable conducta anterior y presentando informes presentenciales que favorecerían al hoy condenado para acceder a esta pena sustitutiva. La lectura de sentencia quedó programada para este lunes en la misma sala. ""Esperamos el fallo, aunque es muy probable que lleguemos a deducir un recurso de nulidad"", adelantó el defensor."
