,title,text
3,Región: OS 9 ubica a imputado de crimen de concejal electo y se entrega en cuartel,"Una denuncia por un presunto delito de connotación sexual contra el fallecido concejal electo Richard Barría, es lo que presentó en la Fiscalía de Puerto Varas el joven que desde ayer está en calidad de imputado por el homicidio del edil. La acusación en la entidad persecutora fue realizada ayer, pero Carabineros ya tenia un cerco policial en torno a Franco Javier del Solar Villarroel, de 18 años, quien a través de un tercero adelantó a la policía que se iba a entregar en presencia de su defensor. Se trata del abogado Sergio Díaz, de Temuco, quien acompañó en todo momento a su cliente en el cuartel de la sección del OS 9 de Carabineros, mientras declaraba ante el fiscal Fabián Fernández. Fue alrededor de las 16.50 horas que el persecutor penal solicitó la orden de detención al Juzgado de Garantía, para la audiencia de control de la detención de este jueves. Del Solar Villarroel, con domicilio en Llanquihue, no registra antecedentes penales, pero sí cinco detenciones cuando era menor de edad: dos por lesiones leves con arma blanca, dos por desórdenes y una por riña. Fue la fiscal regional, Carmen Gloria Wittwer quien entregó una serie de antecedentes respecto de la investigación que se extendió por casi 24 horas, por parte del OS 9 y el Labocar, ambos de Carabineros. Incluso en el sitio del suceso la labor se mantuvo por 15 horas, para levantar diversa evidencia y ser llevada a la próxima audiencia de formulación de cargos. ""El OS 9 de Carabineros ha detenido al imputado por su participación en el homicidio de un concejal electo de Llanquihue, luego de una investigación que partió ayer (martes) comenzando con las diligencias a cargo del fiscal Fabián Fernández, quien solicitó la presencia del Labocar y el OS 9 (de Carabineros). Se levantaron múltiples antecedentes y se pudo establecer que había intervención de terceros"", especificó la fiscal Wittwer. Indicó que el imputado acudió -previa coordinación con el fiscal- a prestar declaración en el OS 9 ""sindicándose como autor del homicidio"". Según la jefa regional del Ministerio Público, el móvil aún es materia de investigación. El fiscal pedirá ampliación de la detención, en la audiencia de hoy en el Tribunal de Garantía de Puerto Varas. ""Es necesario agregar que hoy (ayer) se recibió en la Fiscalía de Puerto Varas una denuncia por algún hecho de connotación sexual en relación con este incidente"", añadió la fiscal regional. Hay varios puntos que fueron aclarados por Carmen Gloria Wittwer, como por ejemplo que el imputado no tenía denuncias contra la víctima. ""En el Ministerio Público lo que se recibió es una denuncia sindicando que fue víctima de hechos de connotación sexual por parte de la víctima"", remarcó. Respecto de las publicaciones en redes sociales que hablaban de un móvil político, la persecutora penal señaló que no existen antecedentes respecto de ello. ""No aparece ningún móvil de tipo político en este hecho y hasta el momento no hemos podido establecer ningún vínculo entre la víctima y victimario"", afirmó. La autoridad del ente persecutor en la región, dijo que son muchas las aristas que aún están en plena investigación. ""Al parecer ambos se habrían conocido en algunos eventos sociales, pero desconocemos qué relación habrían tenido"", manifestó. Relató que ""se necesita más antecedentes para proceder a la detención y pedir medidas cautelares. La calificación jurídica será materia de análisis en las próximas horas, de acuerdo a lo que se recoja en materia criminalística y del médico legal"". Wittwer confirmó además que es efectivo que se encontró en el sitio del suceso una palabra en una pared de la casa de la víctima. Según expuso, estaba escrito ""violador"", aunque no se pudo definir si el autor de ellos fue el imputado. El general Patricio Yáñez, jefe de la Décima Zona de Carabineros añadió que no existe parentesco familiar ni laboral entre el imputado y la víctima. De acuerdo al coronel Fernando Fajardo, prefecto de Carabineros, cada vez que ocurre un crimen como el del concejal ""causa una conmoción grande en el barrio y en la comuna, más aun donde existe cierta familiaridad entre los residentes. Y si a ello se le agrega una autoridad querida, genera una situación que afecta mucho a la gente"". Fajardo explicó que conocidos los antecedentes del hecho se dispuso de todos los medios para establecer cómo ocurrió el crimen ""y determinar la identidad de él o los autores materiales para detenerlos y colocarlos a disposición de tribunales"". Recalcó que lo que se está investigando busca aclarar todos los aspectos de lo ocurrido ""y no dejar dudas"". Según el oficial ""todas esta investigaciones tienen complejidades, y parte con el escenario y el sitio del suceso, que es apartado, donde no hay vecinos alrededor y no hay testigos oculares del hecho. No existe la cantidad de cámaras suficientes, pero eso no es impedimento para cumplir con nuestro objetivo final, que es aclarar completamente el hecho, dando un primer paso con un imputado en las últimas horas"", resaltó. Aunque varios aspectos de la indagatoria serán confirmadas por la necropsia, el prefecto Fajardo añadió que ""la primera estimación habla de una data de muerte de más de 24 horas, pero ello quedará sujeto y aclarado con los resultados de los exámenes tanatológicos"", reveló. El prefecto de Carabineros descartó por ahora la posibilidad que se haya registrado un robo. ""Aparentemente, no faltarían especies en la casa, ello está sujeto a la investigación"". El primer informe del martes, tras ser descubierto el crimen, daba cuenta de la no existencia de fuerza en las cosas. Ayer, la Municipalidad de Llanquihue autorizó que el velatorio fuera realizado en el gimnasio de la Escuela Inés Gallardo. Llegaron más de 100 personas. Hubo aplausos y llantos de algunos vecinos. Por protocolo se permitía el ingreso de 15 personas, por un tiempo limitado. Rodrigo Moreno, ex dirigente y fundador del Partido Ciudadanos, dijo que no tuvo la oportunidad de conocer a Richard Barría, pero señaló que es una autoridad electa en una zona relativamente tranquila. ""Que pase esto, es muy aberrante, por la familia, los amigos y la gente que votó por él. Se tiene que esclarecer rápido, lo que puede ser beneficioso para la tranquilidad de los vecinos y de sus electores, sobre todo los que confiaron en el resultado"". El diputado Alejandro Bernales (PL) se sumó a la consternación por el deceso del concejal electo Richard Barría. Detalló que el edil se notaba una persona muy cercana a los vecinos ""y por ello nos queremos sumar a las condolencias de su familia y seres queridos. Tomé contacto con la presidenta del Partido Ciudadanos, Ignacia Gómez, y me contó que estaban impactados con lo que le había ocurrido a Richard, quien además hace poco había asumido como presidente regional del Partido Ciudadanos, que pertenece a nuestra coalición"". Francisco Vásquez, ex candidato a alcalde por Llanquihue, era uno de los cercanos de Richard Barría, con quien trabajó en el municipio llanquihuano durante varios años. ""Sabemos que estaba separado y era visitado constantemente por su hija adolescente. El 15 (de mayo) día de las elecciones, la conocí y él me la presentó. Fue el último día que conversamos. Recorrimos algunos locales y él me manifestó que votaría por mí como candidato a alcalde"". Vásquez agregó que lo conocía ""desde los 10 años, cuando vivía en la población Manuel Montt. Después llegó a vivir a la población Bernardo Philippi, en Llanquihue"". Relató que el edil electo trabajó con el ex alcalde Walterio Vargas ""entre los años 2004 y 2008. Desde el 2008 al 2012 fue concejal y trabajamos juntos en el mismo periodo. Su segundo período como concejal fue entre 2012 y 2016"". Reconoció que había una buena amistad con Richard Barría. ""Muchas veces me contó algunas confidencias. Tengo la mejor impresión de él como persona. Cuando trabajó en el DAEM gestionó muchas cosas con los estudiantes. Era prácticamente jefe de los asistentes sociales que estaban en cada establecimiento educacional. Hizo buena gestión. Fue cercano a la gente, especialmente a los estudiantes que evidenciaban problemas. Siempre gestionando y entregando soluciones"", resaltó Vásquez, quien agregó que siente ""mucho dolor por lo ocurrido""."
4,Homicidio de concejal electo en Llanquihue: Anuncian prisión preventiva para único imputado," Tras ser arrestado el pasado miércoles, el Tribunal de Garantía de Puerto Varas confirmó la medida cautelar de prisión preventiva para el joven de 18 años acusado del homicidio del concejal electo de Llanquihue, Richard Barría, quien fue encontrado sin vida en su vivienda ubicada en Loncotoro. Según lo sostenido por Radio Bio-Bio, durante la formalización del imputado, identificado con las iniciales F.J.S.V., se relató que el joven estuvo en el inmueble de Barría consumiendo bebidas alcohólicas, generándose una discusión que finalizó en el asesinato. En consecuencia, el acusado tendrá que cumplir la medida cautelar de prisión preventiva fijada por el Juzgado, durante el plazo de 120 días para el cierre de la investigación. Cabe recordar que el presunto autor del delito confesó el crimen el pasado miércoles 2 de junio, donde además acusó ser víctima de hechos de connotación sexual por parte de la autoridad electa. Foto: Cedida.  EN VIVO: Juzgado de Garantía de Puerto Varas decretó la medida cautelar de prisión preventiva para F.J.S.V., imputado como autor de homicidio simple de Richard Barría, perpetrado en Llanquihue. Plazo de investigación: 120 días.https://t.co/d4ZzykIHcC pic.twitter.com/Bp0shBfytX"
5,Imputado por el homicidio del Concejal Electo Richard Barría se entregó a la justicia,"En la tarde de ayer, la fiscalía confirmó que el imputado por el homicidio del Concejal Electo Richard Barría, se entregó a la justicia en compañía de su abogado y prestó declaración ante el Fiscal Fabián Fernández quien lleva el caso. La Fiscal Regional, Carmen Gloria Wittwer, informó que el imputado de 18 años, se entregó a personal de Carabineros, concurriendo, previa coordinación con el fiscal Fabián Fernández, al OS9 de Carabineros  a prestar declaración, sindicándose como autor de las lesiones que llevaron finalmente a la muerte del concejal. “El imputado pasará hoy a control de detención y fiscalía pedirá la ampliación de la detención para ser formalizado en los próximos días. El móvil del crimen es materia de investigación, sin embargo, el día de hoy(ayer) se recibió una denuncia en fiscalía de Puerto Varas por parte del imputado del homicidio, una denuncia de connotación sexual, en relación con este incidente” señaló la Fiscal regional. “Es muy pronto para aseverar o descartar nada, pero hasta el momento no aparece ningún móvil de tipo político y hasta el momento los antecedentes señalan que habría actuado solo. El imputado tiene 18 años, domicilio en Llanquihue y no tiene antecedentes penales”. La data de muerte está siendo investigada y será contrastada con los datos entregados por el imputado. Por otra parte, el cuerpo del Concejal Electo fue entregado en la tarde de ayer por el SML a sus familiares y fue recibido por una gran cantidad de gente en Llanquihue."
6,Domínguez sacó 11 votos para la vicepresidencia,"Gaspar Domínguez, uno de los cuatro constituyentes por el distrito de Chiloé, Palena y parte de la provincia de Llanquihue, fue el único del distrito 26 mencionado ayer en las elecciones de la mesa directiva de la Convención Constitucional. En efecto, el médico del Hospital de Palena que fue electo para redactar la nueva carta fundamental por la lista de Independientes Nueva Constitución logró 11 preferencias en la tercera votación para dirimir al vicepresidente de la instancia. El cargo finalmente lo asumió el abogado frenteamplista Jaime Bassa. Domínguez incluso subió una fotografía suya junto a la presidenta de la Convención Constitucional, la académica mapuche Elisa Loncón. ""Gracias presidenta @ElisaLoncon por mencionar en su discurso a la diversidad sexual y por celebrarme las uñas. Contentísimo y emocionado de este nuevo Chile. #ConvencionConstitucional #ElisaLonconPresidenta"", posteó el galeno en alusión a su defensa por los derechos de la comunidad Lgbti+. Por su parte, Katerine Montealegre (UDI), también convencionalista por el distrito, escribió ayer en sus redes sociales: ""Unidos y con alegría recogiendo nuestras credenciales para el gran día. Sin duda tengo a los mejores partner de bancada @constanzahube.constituyente @eduardocrettonr @mena_felipe @raneumannb @pablotolozaconstituyente @harry_jurgensen @rodrigoalvarez_constituyente ¡Vamos por esa Constitución #DeLosLibres! Y a cantar el himno tan fuerte que se escuche desde Arica a Punta Arenas""."
7,Imputado de violar a menor de 14 años tenía dos condenas por el mismo delito,"Vecinos, familiares y carabineros ubicaron a un imputado por el delito de violación de una menor de 14 años, en un hecho ocurrido la noche del miércoles en el sector costero de Piedra Azul en la Carretera Austral. Fueron los policías del retén de Piedra Azul quienes recibieron la denuncia de parte del hermano de la niña, la que fue abordada por el imputado cuando retornaba a su hogar desde Puerto Montt, a la altura del kilómetro 10,5, en el sector del puente Cunco de la Ruta 7. Los antecedentes indican que la adolescente habría sido atacada por José Mauricio Guerrero Llanquin (45 años), quien la agredió y amenazó portando un arma cortopunzante. La agresión sexual se habría concretado en un sitio eriazo. Los mismos antecedentes indican que Guerrero Llanquin registra condenas por delitos similares, desde los 18 años. El imputado mantiene sentencias por robo en lugar habitado y violación sodomítica en 1994. También registra antecedentes como autor del delito de robo con violencia consumado, de 2008. Fue condenado como autor del delito consumado de violación en 2012 y como autor de hurto en calidad de frustrado. De acuerdo al coronel Fernando Fajardo, prefecto de Carabineros, tras la denuncia se activó el protocolo de búsqueda del imputado por parte de las Secciones de Investigaciones Policiales (SIP) de la Segunda, Quinta y Séptima Comisaría, más una patrulla de la sección del OS 9 de la prefectura Llanquihue. ""Alrededor de las 22 horas (del miércoles) se logra ubicar y detener al imputado de este hecho, quien en el momento de su detención, se estableció que tiene un nutrido prontuario penal, donde destacan hechos relacionados con delitos sexuales"". El procedimiento, por disposición del Ministerio Público, quedó a cargo de la Brigada Investigadora de Delitos sexuales (Brisex) de la PDI. El subprefecto Luis Campos, jefe de la Brigada Investigadora de Delitos Sexuales, confirmó que la niña fue auxiliada por vecinos. Campos anota que las diligencias investigativas se llevaron adelante hasta la madrugada de ayer. ""En la madrugada se realizaron diligencias por un delito de violación, donde un sujeto aborda a una víctima de 14 años, cuando ella retornaba desde Puerto Montt. El sujeto la amenaza con un cuchillo, la golpea y la viola. La menor fue auxiliada por vecinos del sector quienes junto a carabineros procedieron a la ubicación del imputado, quien fue detenido"", apunta. Marcelo Maldonado, fiscal jefe de Puerto Montt, puntualiza que el imputado fue formalizado por violación. ""Como Fiscalía imputamos estos hechos ilícitos el día de hoy (ayer) y solicitamos al tribunal la prisión preventiva, que la acogió y determinó un plazo de investigación de 5 meses para recoger todos los antecedentes que faltan y de esa forma ver cómo evoluciona la causa y llegar a un estado de un juicio oral"". Según Maldonado la idea es concretar acciones de reparación a la víctima, tanto en justicia como la intervención que están haciendo profesionales de la unidad de atención a víctimas y testigos de la Fiscalía Regional. ""Es un delito preocupante y como Fiscalía nos interesa poder hacer persecución penal de este tipo de ilícitos, porque entendemos que afectan a la infancia y bienes jurídicos que son muy valiosos para la sociedad"". Para el abogado penalista, Rafael Gallardo, ""la pena cumplida es pena pagada"", ante la libertad en la que se mantenía el imputado que habría atacado a la niña de 14 años en la Carretera Austral. Gallardo recordó que las penas se han ido subiendo en materia de homicidio, violación y aumentaron los requisitos para los beneficios, ""y ahora aumentaron las exigencias, por ejemplo, para las libertades condicionales. Se aumentó la pena hoy en día para el hurto en condiciones de riesgo de un niño o niña"", resalta. Agrega que las penalidades se han incrementado debido a la intensidad de los delitos, y ejemplifica que ""antiguamente tener un arma era una pena baja, y ahora es una pena de tres años y un día, y ni siquiera tienen beneficios, son penas más altas que el microtráfico e incluso que el abuso sexual"", remarca. 14 años tiene la niña que la tarde del miércoles fue ultrajada en la Carretera Austral. Fue atacada cuando iba rumbo a su casa."
8,Diputado Espinoza molesto por contrata en CFT Estatal de acusado de violación a menor.,"El diputado socialista por el Distrito 25, Fidel Espinoza Sandoval, calificó como inaceptable la respuesta entregada por el rector (s) del Centro de Formación Técnica Estatal de la Región de Los Lagos, Richard Villegas, quien le indicó que uno de los jefes de adquisiciones del centro educacional acusado de violación a un menor y detenido en la cárcel de Alto Bonito en Puerto Montt estaba con permiso y sin goce de sueldo. Espinoza recordó que el Centro de Formación Técnica de Llanquihue fue un sueño para toda la Región de Los Lagos. “Dimos una tremenda lucha, para sacar adelante este proyecto en el Gobierno de la ex presidenta Bachelet”. Para Espinoza, el CFT ubicado en la comuna de Llanquihue ha sido un desastre y ha denunciado tres veces ante la Corporación las irregularidades que se han presentado. “El Centro de Formación Técnica actualmente no tiene infraestructura. Hoy día cuenta una carpa frente a la Copec de Llanquihue, mientras que, los otros centros se están construyendo. A esta altura deberíamos tener un edificio que albergue a 800 o mil alumnos “, dijo. Además, agregó el parlamentario que “actualmente tiene la peor matricula de Chile, su ex rector Carlos Silva, no se preocupó de implementarlo”. “A esta vergüenza debemos sumar, que uno de los jefes de adquisiciones contratado por el ex rector, está hoy privado de libertad en la cárcel de Alto Bonito en Puerto Montt, por violación de un menor de edad”, expuso el diputado PS. El ex presidente de la Cámara de Diputados y Diputadas conversó con el rector (s) Richard Villegas, sobre el tema y este le comunicó que la persona involucrada estaba con permiso sin goce de sueldo. Para Espinoza esta situación es inaceptable. En esta misma línea, el diputado PS ofició al ministro de Educación, Raúl Figueroa, para que de una vez por todas se intervenga este CFT y se devuelva la dignidad a la educación de la Región de Los Lagos. “Este señor que hoy está acusado de una violación de un menor, se le contrato sabiendo que tenía causas de violencia intrafamiliar, por lesiones menos graves y amenazas”, expresó. El congresista explicó que la persona fue contratada, por el ex rector Silva, sabiendo que venía en estas condiciones, violentando lo que dice la propia reglamentación. “Hoy que me digan que esta con permiso sin goce de sueldo, me parece una burla para quienes siempre hemos luchado para que este tipo de situaciones no ocurran”. Para finalizar, Fidel Espinoza espera que el ministro de Educación, Raúl Figueroa, se preocupe de esta situación y sancione severamente a quienes han conducido de mal manera al Centro de Formación Técnica Estatal de la Región de Los Lagos."
9,Investigan presunto acoso sexual del jefe de zona de Carabineros,"Aunque la institución no se ha referido oficialmente a la investigación que es llevada adelante por la Fiscalía Militar en la Décima Zona de Carabineros, autoridades regionales confirmaron la realización de un sumario en contra del general Patricio Yáñez. Si bien no ahondaron en los detalles del sumario, trascendió que la investigación en contra del general Yáñez es producto de una denuncia por un presunto acoso sexual y laboral, tras una denuncia hecha por una funcionaria. La denuncia por un presunto acoso sexual y laboral contra Yáñez fue interpuesta por una funcionaria el viernes 30 de julio. Junto con la investigación que lleva adelante la Fiscalía Militar, la institución policial dispuso que, mientras Yáñez permanece con vacaciones, sea subrogado por el coronel Gustavo Saavedra, prefecto de Carabineros de Osorno. A su vez, en Osorno asumiría también de manera subrogante el mayor Marcelo Salas, comisario de la Segunda Comisaría de Carabineros. El jefe de zona declinó emitir comentarios sobre la indagatoria en su contra y argumentó que está bajo sumario. Quien está a cargo del sumario administrativo es su par de la Región del Maule, Mario Sepúlveda, general y jefe de zona. Para Viviana Sanhueza, seremi de la Mujer y Equidad de Género, ""nada justifica la violencia en contra de las mujeres. En cualquier espacio o en cualquier contexto. Las instituciones deben contar con protocolos para prevenir, atender y sancionar"". Según la autoridad, siempre se deben entregar las máximas garantías y protección a las mujeres víctimas. ""Lo que esperamos es que se realice la investigación correspondiente y que, de ser necesario, se establezcan las sanciones. Nosotros en este momento estamos buscando la forma de contactar a la funcionaria afectada para entregarle todo el apoyo que ella requiera"", resalta. De acuerdo a la experiencia de Kattia Galindo, directora regional del Sernameg, en este tipo de casos se dan varias posibles situaciones: ""Una, que generalmente las víctimas de acoso sexual o laboral se demoran en realizar las denuncias, ya sea por temor o vergüenza. Nosotros cuando tomamos conocimiento siempre hacemos todo lo posible por tomar contacto con la víctima y apoyar con las directrices que nos permite el servicio"", anota. Reconoce la directora que ""es complicado manejar estos hechos en todos los ámbitos"". El delegado presidencial Carlos Geisse confirmó la existencia del sumario y apuntó a la presunción de inocencia. ""Sobre la denuncia en contra del general de zona no me puedo pronunciar, por cuanto existe un sumario administrativo y mientras no se aclare no se puede emitir ninguna opinión. Sólo decir que en Chile la ley estipula la presunción de inocencia, mientras no se pruebe lo contrario"". El oficial a contar de hoy hace uso de sus vacaciones, considerando días pendientes, y para estar con una de sus hijas que padece de una delicada enfermedad. Tres son los períodos que Yáñez lleva como jefe de la Décima Zona. Antes de ello ejerció tres años como jefe de la Prefectura Llanquihue. Además se desempeñó como comisario en la Quinta Comisaría y cumplió funciones en Chiloé y Osorno. Parte de su trayectoria da cuenta además de su participación, cuando era capitán, en la creación del Laboratorio de Criminalística (Labocar) en Puerto Montt. Hasta el cierre de esta nota, Carabineros no emitía comentarios sobre este sumario contra el jefe de zona. 2016 en enero es el año que el oficial asume como prefecto de Carabineros en la prefectura número 25. 2004 es el año que el general Yáñez, cuando era capitán, forma parte de la creación del Labocar en la región. 33 años de servicio lleva el oficial, quien gran parte de su trayectoria la ha cumplido en esta región."
